"","id","titulo_projeto","categorias","cat2","existe"
"968","ANEEL-PD-02866-0370","METODOLOGIA DE AVALIAÇÃO DE DESEMPENHO PARA SATISFAÇÃO DO CLIENTE RESIDENCIAL","6.2",6.2,"sim"
"969","ANEEL-PD-00037-0021","LOTE PIONEIRO COM 100 UNIDADES DE TRANSFORMADOR DE DISTRIBUIÇÃO DE ENERGIA ELÉTRICA COM MEDIÇÃO INTEGRADA DE ENERGIA","6.2",6.2,"sim"
"970","ANEEL-PD-00046-0005","Desenvolvimento de um Sistema de Monitoramento Remoto de Chaves Fusíveis","6.2",6.2,"sim"
"971","ANEEL-PD-00043-0214","Pesquisa para identificação e aplicação das melhores práticas em sistemas de proteção de rede de distribuição em baixa tensão.","6.2",6.2,"sim"
"972","ANEEL-PD-07019-0032","Desenvolvimento de Conjunto Blindado Para Conexão de Condutores de Energia Elétrica","nenhuma categoria encontrada",6.2,"sim"
"973","ANEEL-PD-00063-3010","SELF HEALING  SISTEMA PARA RECONFIGURAÇÃO AUTOMÁTICA DE REDE E ALOCAÇÃO ÓTIMA DE RELIGADORES AUTOMÁTICOS TELECOMANDADOS","6.2",6.2,"sim"
"974","ANEEL-PD-00044-0030","Medidor e Software para Mapeamento de Iluminância em Interiores e Exteriores, com a Determinação Tridimensional de Curvas Isolux para subsidiar Projetos de M&V e Eficiência Energética","1.4",1.2,"sim"
"975","ANEEL-PD-02866-0342","EQUIPAMENTO DE MONITORAMENTO DE IMAGENS PARA OPERAÇÃO DE SUBESTAÇÕES","6.2",6.2,"sim"
"976","ANEEL-PD-00396-0037","Dispositivo para Corte e Religamento no Ramal de Ligação a distância - Lote Pioneiro","nenhuma categoria encontrada",6.2,"sim"
"977","ANEEL-PD-00390-1076","Estudo para Proposição e Análise de Cenários de Composição de Bases Operacionais através de Plataforma de GeoInteligência Sistêmica","nenhuma categoria encontrada",6.2,"sim"
"978","ANEEL-PD-00044-0031","Identificação e avaliação de perdas não-técnicas usando estimação de estados em redes MT e BT e técnicas de clusterização com parâmetros exógenos, para utilização no planejamento da expansão","6.2",6.2,"sim"
"979","ANEEL-PD-00043-0314","Metodologia para Proposição de Política Pública e Regulação em Enterramento de Redes Elétricas nas Cidades de Recife, Salvador e Natal.","""6.2"", ""7.1""",7.1,"sim"
"980","ANEEL-PD-00391-0018","Avaliação de Políticas e Ações de Incentivo às Inovações Tecnológicas no Setor Elétrico: análise da experiência internacional e propostas para o Brasil.","6.2",6.2,"sim"
"981","ANEEL-PD-00064-1041","Estudo de Avaliação de um Novo Óleo Isolante Facilmente Biodegradável, Ecológico, Derivado de Cana-de-Açúcar, Para Aplicação em Transformadores de Potência e de Distribuição.","""2.1"", ""3.4"", ""6.2""",6.2,"sim"
"982","ANEEL-PD-00678-0314","Arquitetura de mercado para a comercialização de energia elétrica no Brasil: análise, simulações e propostas","nenhuma categoria encontrada",6.1,"sim"
"983","ANEEL-PD-00064-1043","Unidade auxiliar de geração de eletricidade com célula a combustível alimentada com hidrogênio obtido do etanol - Fase 2","""3.4"", ""5.1"", ""5.2"", ""7.1""",5.2,"sim"
"984","ANEEL-PD-06491-0279","Aperfeiçoamento do processo de contratação da expansão do parque gerador","7.1",7.1,"sim"
"985","ANEEL-PD-06491-0337","DESENVOLVIMENTO DE METODOLOGIA DE REVISÃO TARIFÁRIA PARA USINAS GERADORAS SOB O REGIME DE COTAS - ASPECTOS DE REGULAÇÃO E ENGENHARIA","7.1",7.1,"sim"
"986","ANEEL-PD-06491-0339","DESENVOLVIMENTO DE METODOLOGIA DE REVISÃO TARIFÁRIA PARA USINAS GERADORAS SOB O REGIME DE COTAS - ASPECTOS DE REGULAÇÃO ECONÔMICA","7.1",7.1,"sim"
"987","ANEEL-PD-00391-0016","Medição e Automação de Iluminação Pública com Integração em Redes Inteligentes","6.2",6.2,"sim"
"988","ANEEL-PD-00382-0084","Plataforma Autônoma para Logística Reversa de Resíduos Sólidos Domésticos","1.4",3.4,"sim"
"989","ANEEL-PD-00390-1077","Desenvolvimento de um Novo Conceito para Redução da Inadimplência e das Perdas Comerciais com Foco no Comportamento dos Clientes em Conjuntos Habitacionais de Baixa Renda","nenhuma categoria encontrada",6.2,"sim"
"990","ANEEL-PD-04950-0466","Sistema de Gestão do Conhecimento Tecnológico da Cemig","1.4",1.4,"sim"
"991","ANEEL-PD-02866-0322","DESENVOLVIMENTO DE SISTEMA DE MONITORAMENTO TÉRMICO ON-LINE DE TRANSFORMADORES DE POTÊNCIA UTILIZANDO SENSORES ÓPTICOS","6.2",6.2,"sim"
"992","ANEEL-PD-00046-0006","Utilização de Dendogramas e Mineração de Dados no Auxílio ao Despacho Otimizado de Turmas de Combate a Fraudes.","nenhuma categoria encontrada",6.2,"sim"
"993","ANEEL-PD-02866-0396","PREVISÃO DE PREÇOS DE ENERGIA E SAZONALIZAÇÃO DA CARGA PARA LEILÕES","7.1",7.1,"sim"
"994","ANEEL-PD-00403-0035","SPARHTACUS - Metodologia para Definição de Políticas Semanais e Mensais do SIN no Horizonte de Médio Prazo com Modelagem Individualizada das Usinas Hidrelétricas","nenhuma categoria encontrada",3.6,"sim"
"995","ANEEL-PD-00382-0087","Cabeça de Serie - Desenvolvimento de Metodologia e Sistema Piloto de Controle da Condição Operativa dos Comutadores sob Carga","6.2",6.2,"sim"
"996","ANEEL-PD-07236-0005","Metodologia de Elaboração da Função de Custo do Déficit","7.1",7.1,"sim"
"997","ANEEL-PD-00642-0002","Metodologia de Elaboração da Função de Custo do Déficit","7.1",7.1,"sim"
"998","ANEEL-PD-02866-0326","DESENVOLVIMENTO DE NANO-ÓLEOS BASEADOS EM ÓLEO MINERAL E ÉSTER NATURAL ISOLANTES PARA APLICAÇÃO EM TRANSFORMADORES","2.1",6.2,"sim"
"999","ANEEL-PD-06072-0291","Cabeça de Série da Sonda desenvolvida no Projeto n° 0406-010/2006: """"PROPOSTA DE PROCEDIMENTO PARA ANÁLISE DE PEDIDOS DE RESSARCIMENTO UTILIZANDO REGISTROS DE PERTUBAÇÕES""""","nenhuma categoria encontrada",NA,"não"
"1000","ANEEL-PD-06072-0289","Atenuador Inteligente de Perdas Técnicas e Regulação do Nível de Voltagem na Rede de Distribuição de Baixa Tensão utilizando a Compensação Magnética","6.2",6.2,"sim"
"1001","ANEEL-PD-06072-0290","Desenvolvimento de metodologia para redução de custos na estimativa de vida à fadiga de cabos condutores de energia.","7.1",7.1,"sim"
"1002","ANEEL-PD-06072-0286","Sistema de monitoramento das variáveis ambientais para apoio à operação do sistema de distribuição da CELG D..","nenhuma categoria encontrada",6.2,"sim"
"1003","ANEEL-PD-00048-1401","Da ideia ao mercado: Desenvolvimento e implementação de método inovador que garanta um processo sistemático e contínuo de geração de valor no desenvolvimento de projetos de PeD+I para a CHESF","nenhuma categoria encontrada",6.1,"sim"
"1004","ANEEL-PD-00039-0074","Desenvolvimento de Conjunto de Parafusos de Segurança e Chave Eletrônica Especial","nenhuma categoria encontrada",6.2,"sim"
"1005","ANEEL-PD-00068-0022","Middleware Sensível ao Contexto para Instanciação do IEC/CIM para Transmissão Brasileira","6.2",6.2,"sim"
"1006","ANEEL-PD-00038-0017","DESENVOLVIMENTO DE CABEÇA DE SÉRIE DE TRANSFORMADOR DE DISTRIBUIÇÃO COM ÓLEO VEGETAL DA AMÊNDOA DE BABAÇU - TOB","""2.1"", ""6.2""",3.4,"sim"
"1007","ANEEL-PD-06491-0257","Pesquisa e desenvolvimento de sistema para monitoração de baterias","6.2",6.3,"sim"
"1008","ANEEL-PD-06491-0321","METODOLOGIA MULTICRITÉRIO DE ANÁLISE E MITIGAÇÃO DE CAMPOS ELETROMAGNÉTICOS EM SUBESTAÇÕES DE TRANSMISSÃO DE ENERGIA ELÉTRICA","6.2",6.2,"sim"
"1009","ANEEL-PD-06585-1501","Proposta metodológica para determinação do fator de potência sob condições distorcidas e desequilibradas","nenhuma categoria encontrada",6.2,"sim"
"1010","ANEEL-PD-02866-0380","PROJETO E DESENVOLVIMENTO DE UM SISTEMA ONLINE DE DETECÇÃO DE FALHAS EM TRANSFORMADORES À ÓLEO POR ANÁLISE DE GASES LIVRES","""2.1"", ""6.2"", ""7.1""",6.2,"sim"
"1011","ANEEL-PD-06908-0001","Utilização de VANT para lançamento de condutores, levantamento topográfico e monitoramento dos aspectos de manutenção aplicado à linha de transmissão","6.2",6.2,"sim"
"1012","ANEEL-PD-00038-0018","Desenvolvimento de Religador Trifásico Nacional Ambientalmente Correto","6.2",6.2,"sim"
"1013","ANEEL-PD-06072-0321","Desenvolvimento de uma Metodologia Otimizada e de um Sistema Inteligente de Diagnóstico e de Planejamento para a área de Engenharia de Manutenção em Transformadores de Potência.","7.1",6.2,"sim"
"1014","ANEEL-PD-06491-0299","TECNOLOGIA DE REALIDADE VIRTUAL, INTERAÇÃO TANGÍVEL, COMPUTAÇÃO PERVASIVA E MODELOS DE SIMULAÇÃO APLICADOS AO TREINAMENTO DE MANUTENÇÃO DE REDES DE TRANSMISSÃO EM LINHA VIVA","6.2",6.2,"sim"
"1015","ANEEL-PD-00038-0016","Recuperação de Mercado - Energia Segura com Inibidores de Furtos","nenhuma categoria encontrada",6.2,"sim"
"1016","ANEEL-PD-06072-0295","Cabeça de Série do Transformador desenvolvido no Projeto n° 31 """"Transformador de Distribuição Inteligente - TDI""""","""1.4"", ""6.2""",NA,"não"
"1017","ANEEL-PD-00394-1507","Análise da Macroturbulência em Vertedouros em Degraus com Pré Aeração","nenhuma categoria encontrada",3.6,"sim"
"1018","ANEEL-PD-06072-0334","Sistema inteligente de integração de dados e de apoio à decisão para o Setor Comercial da CELG D","6.2",6.2,"sim"
"1019","ANEEL-PD-06683-0115","Desenvolvimento de metodologia para monitoramento de movimentação de terreno na área de influencia de barragens via interferometria diferencial por radar aerotransportado","nenhuma categoria encontrada",3.6,"sim"
"1020","ANEEL-PD-00031-0001","Ferramenta Computacional de Alocação Ótima de Dispositivos de Proteção e de Manobra em Redes de Distribuição de Energia Elétrica","6.2",6.2,"sim"
"1021","ANEEL-PD-00031-0001","Ferramenta Computacional de Alocação Ótima de Dispositivos de Proteção e de Manobra em Redes de Distribuição de Energia Elétrica","6.2",NA,"sim"
"1022","ANEEL-PD-00063-3009","PA3009 - Índice de Sustentabilidade Econômico-Financeira das Distribuidoras de Energia Elétrica","nenhuma categoria encontrada",6.2,"sim"
"1023","ANEEL-PD-00031-0002","Ferramenta de Alocação e Dimensionamento Ótimo de Banco de Capacitores, em redes de distribuição de energia elétrica, sob restrições de ressonância harmônica.","6.2",6.2,"sim"
"1024","ANEEL-PD-06072-0302","Sistema de Apoio à Decisão para Restauração de Redes de Distribuição de Energia Elétrica considerando Curvas de Carga dos Transformadores das Subestações.","6.2",6.2,"sim"
"1025","ANEEL-PD-00031-0003","Sistema remoto de monitoramento de pontos quentes em conexões elétricas, utilizando sensores ópticos.","nenhuma categoria encontrada",6.2,"sim"
"1026","ANEEL-PD-05697-0414","Sistema de Recarga Rápida com Armazenamento Híbrido-Estacionário de Energia para Abastecimento de Veículos Elétricos no Conceito de Redes Inteligentes","6.3",1.3,"sim"
"1027","ANEEL-PD-06072-0324","Gestão Inteligente de Armazenamento e Movimentação de Recursos Materiais Utilizando RFID, IA e GPS","nenhuma categoria encontrada",6.2,"sim"
"1028","ANEEL-PD-00031-0004","Sistema para balanceamento automático de carga em tempo real, para redes de distribuição de baixa tensão.","6.2",6.2,"sim"
"1029","ANEEL-PD-06491-0333","DETERMINAÇÃO DE CURVA ESTATÍSTICA DE OPERAÇÃO DE MODELOS DE PREVISÃO DE CHUVA E VAZÃO PARA MAXIMIZAR PROCEDIMENTOS DA OPERAÇÃO DOS RESERVATÓRIOS E PLANEJAMENTO HIDROENERGÉTICO DAS USINAS COPEL","1.4",1.4,"sim"
"1030","ANEEL-PD-05697-0514","Monitoramento Digital em Tempo Real de Aspectos Operacionais, de Qualidade e de Segurança do Trabalho em Serviços da Distribuição de Energia Elétrica","6.2",6.2,"sim"
"1031","ANEEL-PD-06072-0318","Ferramenta Computacional para o Dimensionamento Mecânico e Orçamentário Integrado da Rede de Distribuição Rural de Energia Elétrica.","""6.2"", ""7.1""",7.1,"sim"
"1032","ANEEL-PD-06072-0364","Projeto 51 Telhados em Nova Veneza-GO: Sistema Solar Fotovoltaico de Microgeração Distribuída Conectada à Rede de Baixa Tensão da CELG-D em 51 UCs dentro do Conceito de Redes Elétricas Inteligentes.","""6.2"", ""7.1""",3.1,"sim"
"1033","ANEEL-PD-06072-0368","Validação de Arquiteturas de Automação na Rede de Distribuição via Técnicas Avançadas de Self-Healing e Diferentes Tecnologias de Comunicação, dentro do Conceito Smart Grid","6.2",6.2,"sim"
"1034","ANEEL-PD-06683-0215","Desenvolvimento de sistema mecatrônico remotamente operado para a limpeza e inspeção do batente e soleira de vedação dos Stop Logs de hidroelétricas","nenhuma categoria encontrada",3.6,"sim"
"1035","ANEEL-PD-00382-0088","Modelagem dinâmica para avaliação do impacto de fontes alternativas no sistema de distribuição de energia","6.2",6.2,"sim"
"1036","ANEEL-PD-00394-1508","Controle Modular Wireless para Comportas de Modelos Reduzidos de Usinas Hidrelétricas","nenhuma categoria encontrada",3.7,"sim"
"1037","ANEEL-PD-00394-1506","Modelagem fluidodinâmica computacional (CFD) aplicada a estruturas hidráulicas de aproveitamentos hidrelétricos","nenhuma categoria encontrada",3.7,"sim"
"1038","ANEEL-PD-00394-1504","Metodologias e infraestrutura tecnológica para aperfeiçoamento das avaliações de confiabilidade e otimização de empreendimentos de energia","1.4",1.4,"sim"
"1039","ANEEL-PD-00394-1502","Estudo e Implantação de Rede TIB - Tecnologia Industrial Básica Aplicada ao segmento Eólico (base tecnológica nacional para avaliação, otimização e garantia da qualidade no segmento eólico)","6.2",3.7,"sim"
"1040","ANEEL-PD-00383-0058","Cabeça-de-série do Equipamento para levantamento das curvas de consumo de cada aparelho elétrico residencial, ou grupos semelhantes, sem acesso às instalações da unidade consumidora (IDC).","1.4",1.2,"sim"
"1041","ANEEL-PD-02937-3015","LP3015 - Estruturas de rede de distribuição com aterramento integrado com a ferragem interna para aplicação em áreas urbanas e rurais  - Lote Pioneiro","6.2",6.2,"sim"
"1042","ANEEL-PD-00063-3011","PA3011 - Avaliação de Desempenho de Operadores de Manobras em Redes de Distribuição e Subestações Considerando Avaliação Multicritério","6.2",NA,"não"
"1043","ANEEL-PD-00394-1509","Análise e Previsão da Matriz Analítica de Riscos em Projetos de Transmissão e Geração de Energia","nenhuma categoria encontrada",3.6,"sim"
"1044","ANEEL-PD-00063-3013","DE3013-Desenvolvimento de ferramenta para poda mecanizada noturna a rede elétrica energizada, acoplada a um veículo leve urbano, com fonte de energia híbrida, segurança intrínseca de operação.","6.2",6.2,"sim"
"1045","ANEEL-PD-00394-1503","Desenvolvimento de novas tecnologias para automação de processos em segurança de barragens","nenhuma categoria encontrada",3.7,"sim"
"1046","ANEEL-PD-00097-4914","Hidrogênio Solar Renovável para Resfriamento de Geradores de UTEs","5.1",2.1,"sim"
"1047","ANEEL-PD-00082-0001","PLATAFORMA EXPERIMENTAL DE AUTOMAÇÃO DE ALIMENTADORES DE DISTRIBUIÇÃO DA COCEL","nenhuma categoria encontrada",6.2,"sim"
"1048","ANEEL-PD-00097-0314","Elastômero com uso de resíduo sólido da Usina Termelétrica Presidente Médici (UTPMCandiota)como carga na formulação","3.4",2.2,"sim"
"1049","ANEEL-PD-02866-0274","METODOLOGIA DE MANUTENÇÃO PREVENTIVA PARA DEFINIR A PERIODICIDADE DA SUBSTITUIÇÃO DE EQUIPAMENTOS E ACESSÓRIOS POLIMÉRICOS USADOS EM REDES AÉREAS PROTEGIDAS E NUAS","nenhuma categoria encontrada",6.2,"sim"
"1050","ANEEL-PD-02866-0332","ESTUDO DE TILLANDSIA SPP. (BROMELIACEAE) NAS REDES DE DISTRIBUIÇÃO DE ENERGIA ELÉTRICA","6.2",6.2,"sim"
"1051","ANEEL-PD-02866-0378","DESPACHO DE MICROGERAÇÃO DISTRIBUÍDA","nenhuma categoria encontrada",6.2,"sim"
"1052","ANEEL-PD-00097-0414","Desenvolvimento de um microgerador termoelétrico para captação de energias residuais (termoeletricidade) e nacionalização de materiais termoelétricos","nenhuma categoria encontrada",3.7,"sim"
"1053","ANEEL-PD-06072-0327","Gestão da Operação em Momentos de Crise.","nenhuma categoria encontrada",6.2,"sim"
"1054","ANEEL-PD-06072-0370","Sistema Preditivo de Localização de Falta na Média Tensão.","nenhuma categoria encontrada",6.2,"sim"
"1055","ANEEL-PD-06072-0288","Avaliação qualitativa de posicionamento de rede baseado em imagens utilizando visão computacional.","6.2",6.2,"sim"
"1056","ANEEL-PD-00082-0002","PLATAFORMA EXPERIMENTAL DE AUTOMAÇÃO DE ALIMENTADORES DE DISTRIBUIÇÃO DA COCEL","nenhuma categoria encontrada",6.2,"sim"
"1057","ANEEL-PD-00405-0012","Desenvolvimento de sistema computacional de despacho otimizado e automático de serviços utilizando monitoramento on-line baseado em rede inovadora de comunicação híbrida com meios alternativos","6.2",6.2,"sim"
"1058","ANEEL-PD-02651-0011","Tecnologia de sensores em fibras optica para supervisao, controle e protecao de sistemas de energia eletrica- TECCON 2.","6.2",6.2,"sim"
"1059","ANEEL-PD-00405-1507","Automação e Reformulação Inteligente da rede de distribuição para enfrentar o desafio da melhoria contínua dos Indicadores de Continuidade","6.2",6.2,"sim"
"1060","ANEEL-PD-00404-1511","Concepção de Modelo e Software para Alocação Otimizada de Reatores em Alimentadores Primários e Priorização de Ações Visando a Redução das Perdas Técnicas","nenhuma categoria encontrada",6.2,"sim"
"1061","ANEEL-PD-00404-1512","Sistema Inteligente e Integrado de Operação para Maximização da Continuidade de Fornecimento de Energia Elétrica","nenhuma categoria encontrada",6.2,"sim"
"1062","ANEEL-PD-05785-4101","Protótipo de sistema de diagnóstico de hidrogeradores a partir do  monitoramento permanente e em tempo real de parâmetros da função geração","6.2",6.2,"sim"
"1063","ANEEL-PD-00391-0019","Geração distribuída urbana utilizando sistemas fotovoltaicos e armazenamento de curto prazo: serviços ancilares, avaliação dos impactos para a distribuidora e desenvolvimento de modelos de negócio","""6.2"", ""6.3""",3.1,"sim"
"1064","ANEEL-PD-02866-0390","DESENVOLVIMENTO DE PRODUTOS PARA A LIMPEZA DE FERRAMENTAS PARA EQUIPAMENTOS DE PROTEÇÃO INDIVIDUAL E COLETIVA APLICADOS NO SERVIÇO DE REDES ENERGIZADAS","nenhuma categoria encontrada",6.2,"sim"
"1065","ANEEL-PD-02866-0410","DESENVOLVIMENTO DE PROTÓTIPOS DE EQUIPAMENTOS PARA ENSAIO MECÂNICO EM EPI E EPC UTILIZADOS EM TRABALHOS COM LINHA VIVA","nenhuma categoria encontrada",6.2,"sim"
"1066","ANEEL-PD-06683-0315","Desenvolvimento de Cabeça de Série de Simulador da Operação de Usina Hidroelétrica - SOUH","""3.6"", ""6.2""",6.2,"sim"
"1067","ANEEL-PD-00381-0007","Nacionalização de Microinversor Fotovoltaico de 500 Wp com Alto Rendimento e em Conformidade com os Requisitos de Qualidade de Energia da Resolução Normativa ANEEL 482/2012","nenhuma categoria encontrada",3.7,"sim"
"1068","ANEEL-PD-00075-1506","Desenvolvimento de infraestrutura de interoperabilidade para apoiar os processos de negócios de uma distribuidora permitindo a utilização de dados complexos no acompanhamento e operação do sistema..","nenhuma categoria encontrada",6.2,"sim"
"1069","ANEEL-PD-00032-1509","Desenvolvimento de Modelo de Automação e Otimização do Despacho Dinâmico de Equipes baseado em Indicadores.","7.1",7.1,"sim"
"1070","ANEEL-PD-00084-1516","Otimização de Manutenção e Reenergização de Redes de Distribuição sob Condição de Falta Através de Sistema Próprio de Sinalização..","6.2",6.2,"sim"
"1071","ANEEL-PD-05217-1515","Compartilhamento de Estruturas de Linhas de Subtransmissão 72.5 & 145 kV e Redes de Distribuição 15, 25 & 36.2 kV - Estudos Mecânicos, de Transitórios e Modelos para Validação Técnica & Econômica.","""6.2"", ""7.1""",7.1,"sim"
"1072","ANEEL-PD-02608-7503","Desenvolvimento e Aplicação de um Sistema de Medição de Grandes Áreas (WAMS) utilizando Equipamentos do tipo PMU no Sistema de Transmissão da STATE GRID BRAZIL","7.1",7.1,"sim"
"1073","ANEEL-PD-00051-1501","Sistema de Transferência de Energia Sem Contato Altamente Eficiente baseado em um Conversor Ressonante Rotativo Compacto para Motores Síncronos de Pequeno Porte","""1.4"", ""3.2""",1.1,"sim"
"1074","ANEEL-PD-00032-1510","Desenvolvimento de solução integrada de controle otimizado de tensão e reativos (Volt/VAr) para sistemas de distribuição","nenhuma categoria encontrada",6.2,"sim"
"1075","ANEEL-PD-00032-1513","Ferramenta Inteligente para Planejamento e Gestão do Manejo de Árvores ao Longo das RD de Energia Elétrica Utilizando Técnicas de Processamento e Análise de Imagens de Satélites de Alta Resolução.","""3.1"", ""7.1""",6.2,"sim"
"1076","ANEEL-PD-00405-1508","Metodologia p/ desenvolver e implantar modelos de mecanização com foco na construção e na manutenção de redes de distribuição, considerando Redes Elétricas Inteligentes e abordagem de Design Thinking","6.2",6.2,"sim"
"1077","ANEEL-PD-05785-4201","Estratégias para substituição de transformadores de potência em subestações considerando risco de falha, fator de impacto para o sistema e análise monetária de acordo com panorama da concessionária","7.1",7.1,"sim"
"1078","ANEEL-PD-00051-1502","Manejo de macrófitas e destinação de sua biomassa para a geração de energia elétrica na Usina Bortolan em Poços de Caldas, MG","3.4",3.4,"sim"
"1079","ANEEL-PD-02608-1346","Modelagem e avaliacao do desempenho de conversores com capacitor de comutacao (CCC) em sistemas multiplos de corrente continua","""6.2"", ""7.1""",7.1,"sim"
"1080","ANEEL-PD-00372-9990","Exploração de Energia Solar em Lagos de Usinas Hidrelétricas","3.1",3.1,"sim"
"1081","ANEEL-PD-04380-0002","ESTUDO E DESENVOLVIMENTO DE METODOLOGIAS DE INSPEÇÃO AUTÔNOMA EM LINHAS DE TRANSMISSÃO","6.2",6.2,"sim"
"1082","ANEEL-PD-00610-1004","SMART-SEN - Um Modelo de Simulação do Sistema Elétrico Nacional com Presença de Geração de Renováveis Intermitentes","7.1",7.1,"sim"
"1083","ANEEL-PD-02608-1201","DESENVOLVIMENTO DE MODELAGEM PARA AVALIACAO DO USO DE ELETRODOS MARITIMOS EM SISTEMAS DE CORRENTE CONTINUA","""6.2"", ""7.1""",7.1,"sim"
"1084","ANEEL-PD-00404-1502","Elaboração de metodologia de suprimento de energia elétrica a sistemas isolados no Pantanal Sul-Matogrossense","nenhuma categoria encontrada",3.7,"sim"
"1085","ANEEL-PD-05707-4301","Controle dinâmico inteligente para reguladores de tensão e sistemas supervisórios (CDI-RT) em ambiente smart grid.","nenhuma categoria encontrada",6.2,"sim"
"1086","ANEEL-PD-00063-3014","DE3014 - Thermovision - Sistema de detecção automática de pontos quentes a partir de uma imagem térmica","3.1",6.2,"sim"
"1087","ANEEL-PD-00369-0009","""""Sistema de Segurança e Monitoramento Remoto de Técnicos em Manutenção de Sistemas Elétricos - SAFETEC""""","nenhuma categoria encontrada",NA,"não"
"1088","ANEEL-PD-00026-0116","SARA - Sistema remoto de análise contínua do estado operacional de equipamentos de alta tensão através do monitoramento do óleo isolante via Impedância Elétrica em Rádio Freqüência","""2.1"", ""3.1"", ""6.2"", ""7.1""",6.2,"sim"
"1089","ANEEL-PD-00394-1510","Aproveitamento Energético de Resíduos Sólidos Urbanos a partir da Tecnologia de Gaseificação de Leito Fixo","3.4",3.4,"sim"
"1090","ANEEL-PD-00369-0010","SISTEMA DE CONEXÃO DE MICROGERADORES COM A REDE DE DISTRIBUIÇÃO DE ENERGIA ELÉTRICA PARA VIABILIZAÇÃO DE CENTRAIS VIRTUAIS DE ENERGIA","""6.2"", ""7.1""",7.1,"sim"
"1091","ANEEL-PD-00396-0039","Planejamento Dinâmico de Operações","7.1",6.2,"sim"
"1092","ANEEL-PD-00396-0038","Solução Inovadora para Gerenciamento Ativo de Sistemas de Distribuição","nenhuma categoria encontrada",6.2,"sim"
"1093","ANEEL-PD-00383-0059","Desenvolvimento de metodologia Mapa de Riscos para a análise da variável socioeconômica violência no diagnostico de perdas não técnicas de energia.","nenhuma categoria encontrada",6.2,"sim"
"1094","ANEEL-PD-05785-4202","Desenvolvimento de técnicas de mitigação de desarmes de proteção de linhas de transmissão, devido ao Sudden Flashover.","6.2",6.2,"sim"
"1095","ANEEL-PD-06491-0307","PROJETO LYNX - OTIMIZAÇÃO EM LARGA ESCALA APLICADA AO DESPACHO HIDROTÉRMICO BRASILEIRO: MODELOS HIERÁRQUICOS DE OPERAÇÃO E PLANEJAMENTO EM MÉDIO E CURTO PRAZOS COM INTEGRAÇÃO DE ENERGIA E POTÊNCIA","""6.2"", ""7.1""",7.1,"sim"
"1096","ANEEL-PD-00369-0011","Gestor Integrado de Falhas","6.2",6.2,"sim"
"1097","ANEEL-PD-05457-1601","Solução Inovadora de Supervisão de Linhas de Transmissão Embarcando Dispositivos de Monitoramento não Convencionais e Análise Automatizada de Resultados","6.2",6.2,"sim"
"1098","ANEEL-PD-00402-7001","Desenvolvimento de uma Rede de Sensores Passivos para Medição de Integridade de Equipamentos em Sistemas de Energia com Transmissão sem Fio","6.2",6.2,"sim"
"1099","ANEEL-PD-00372-9992","Soluções para eliminação de limo e outros materiais característicos da região amazônica de isoladores de Subestações da Regional de Transmissão do Pará","nenhuma categoria encontrada",3.6,"sim"
"1100","ANEEL-PD-05016-1602","Dispositivo para Adequar Malas de Testes de Relés à Tecnologia Sampled Values, Conforme IEC 61850","6.2",6.2,"sim"
"1101","ANEEL-PD-00391-0020","Sistema Inteligente de Apoio à Decisão Para Substituição Preventiva de Para-Raios no Sistema de Distribuição da EDP","6.2",6.2,"sim"
"1102","ANEEL-PD-00402-1915","Desenvolvimento de uma planta Heliotérmica dentro da área de usina hidrelétrica de Passo São João, no município de Roque Gonzales no Rio Grande do Sul","3.1",3.1,"sim"
"1103","ANEEL-PD-00051-1503","Desenvolvimento de um mecanismo para ganho de capacidade de armazenamento em reservatório","""2.1"", ""6.3""",3.6,"sim"
"1104","ANEEL-PD-00380-0019","Desenvolvimento de Sistema de Supervisão e Controle da QEE de Curta e Longa Duração na Rede de Distribuição de MT utilizando Reguladores de Tensão.","6.2",6.2,"sim"
"1105","ANEEL-PD-02651-0012","Desenvolvimento de metodologia de otimização de traçado e projeto de linhas de transmissão empregando técnicas quantiqualitativas em sistema de informações geográficas.","""6.2"", ""7.1""",7.1,"sim"
