"","id","titulo_projeto","categorias","cat2","existe"
"1387","ANEEL-PD-00385-0025","Relé Inteligente para Iluminação Pública com Interface de Rede para Smart Grid ELEKTRO","1.4",NA,"não"
"1388","ANEEL-PD-00385-0027","Sistema compacto de avaliação e gerenciamento de hábitos de uso de energia elétrica","6.2",NA,"não"
"1389","ANEEL-PD-00385-0028","D TCSC: Compensador Série Eletronicamente Controlado para o Sistema de Distribuição da Elektro","nenhuma categoria encontrada",6.2,"sim"
"1390","ANEEL-PD-00385-0029","Ferramenta Inteligente de Análise de dados Elektro","nenhuma categoria encontrada",NA,"não"
"1391","ANEEL-PD-00385-0032","Desenvolvimento de Sistema Neuro-Fuzzy para Previsão de Carga em Sistemas de Distribuição de Energia Elétrica","nenhuma categoria encontrada",NA,"não"
"1392","ANEEL-PD-00385-0034","Metodologia de Implantação de Gerenciamento de Decisão para o Processo de Perdas não Técnicas","nenhuma categoria encontrada",6.2,"sim"
"1393","ANEEL-PD-00385-0035","Implantação de Acessibilidade Otimizada no Atendimento ao Cliente","nenhuma categoria encontrada",NA,"não"
"1394","ANEEL-PD-00385-0037","Planta de Geração de Energia com Pilha a Combustível de Óxido Sólido","nenhuma categoria encontrada",3.4,"sim"
"1395","ANEEL-PD-00385-0040","Gestão e Retenção do Conhecimento Empresarial, também dos Métodos, Processos, Atividades, etc. com o desenvolvendo de Aplicativo Computacional Dedicado as Empresas do Setor Elétrico","nenhuma categoria encontrada",NA,"não"
"1396","ANEEL-PD-00385-0043","Desenvolvimento de Sistema de Recarga rápida para veículos de transporte de passageiros com propulsão elétrica dotados de ultracapacitores","1.4",1.3,"sim"
"1397","ANEEL-PD-00385-0044","Sistema Radio Comunicador de Alcance Médio usando Tecnologia Mesh para Gestão de Ativos e do Sistema de Energia Elétrica com Interface de Rede para Smart Grid ELEKTRO..","""6.2"", ""7.1""",NA,"não"
"1398","ANEEL-PD-00385-0048","Sistemas de microturbina solar-híbrida para cogeração de eletricidade e calor para o setor agroindustrial","""1.4"", ""6.1"", ""7.1""",1.4,"sim"
"1399","ANEEL-PD-00385-0049","Projeto Cesta Aérea Hibrida com mitigação de emissão de gases de efeito estufa - Acionamento Elétrico.","nenhuma categoria encontrada",1.3,"sim"
"1400","ANEEL-PD-00385-0008","Sistema Inteligente Para Otimização e Planejamento das Liberações Para Manutenção e Expansão em Redes de Distribuição da ELEKTRO","""6.2"", ""7.1""",6.2,"sim"
"1401","ANEEL-PD-00385-0004","Desenvolvimento de Sistema e Protótipo Operacional para Sensoreamento de Ações durante a Capacitação para Manutenção em Linha Viva e Restabelecimento de Redes de Distribuição de Energia Elétrica","6.2",6.2,"sim"
"1402","ANEEL-PD-00385-0002","Análise Técnica e Estratégica Visando Otimização de Desempenho do Sistema Elétrico da ELEKTRO","nenhuma categoria encontrada",6.2,"sim"
"1403","ANEEL-PD-00385-0005","Avaliação das características das novas estruturas de cargas não lineares, seu impacto na qualidade da energia e nas ações corretivas necessárias no sistema de distribuição da ELEKTRO","6.2",6.2,"sim"
"1404","ANEEL-PD-00385-0033","Desenvolvimento de Dispositivo Automático Para Regulação de Tensão no Sistema Elétrico de Distribuição de Baixa Tensão da ELEKTRO","6.2",6.2,"sim"
"1405","ANEEL-PD-00385-0053","Geração distribuída com fontes alternativas e renováveis de energia em ambiente de Micro-redes, Smart-Grid: Metodologias de medição, Segurança operacional e impactos na Qualidade de Energia","6.2",3.7,"sim"
"1406","ANEEL-PD-00385-0003","Previsão de Curto, Médio e Longo Prazo da incidência de descargas atmosféricas na área de concessão da ELEKTRO","nenhuma categoria encontrada",6.2,"sim"
"1407","ANEEL-PD-00385-0056","Dispositivo de Monitoramento de Contaminantes Depositados em Isoladores Elétricos de Distribuição Para Propósitos de Manutenção Preventiva","6.2",6.2,"sim"
"1408","ANEEL-PD-00385-0001","Metodologia para Estabelecimento de Estrutura Tarifária para o Serviço de Distribuição de Energia Elétrica","nenhuma categoria encontrada",NA,"não"
"1409","ANEEL-PD-06898-0001","Metodologia para Otimização Multicritério e Dinâmica de Sistemas Rurais de Distribuição, Considerando Custos Operacionais e Investimentos em Novos Elementos de REI Sob Critérios Técnico-Regulatórios","7.1",7.1,"sim"
"1410","ANEEL-PD-03619-1001","Células a combustível contendo nanocatalisadores para atendimento, com alto grau de eficiência energética, a serviços auxiliares de SEs","1.4",5.2,"sim"
"1411","ANEEL-PD-03619-1002","Desenvolvimento de inibidor de deposição de poluentes condutores e detector de fissuras na superfície de isoladores de Linhas de Transmissão","6.2",6.2,"sim"
"1412","ANEEL-PD-03619-1003","Caracterização e avaliação do impacto de agentes poluentes em isoladores de LTs considerando a sazonalidade climática e o comportamento de variáveis meteorológicas regionais","6.2",6.2,"sim"
"1413","ANEEL-PD-08102-0001","Desenvolvimento e teste de sistema de monitoramento de estado de Chave Seccionadora de subestação por fibra óptica.","nenhuma categoria encontrada",6.2,"sim"
"1414","ANEEL-PD-08103-0001","Desenvolvimento e teste de sistema de monitoramento de estado de Chave Seccionadora de subestação por fibra óptica.","nenhuma categoria encontrada",6.2,"sim"
"1415","ANEEL-PD-08397-0001","Desenvolvimento e teste de sistema de monitoramento de estado de Chave Seccionadora de subestação por fibra óptica.","nenhuma categoria encontrada",6.2,"sim"
"1416","ANEEL-PD-00382-0096","Projeto Lote Pioneiro para óleo biodegradável substituto ao óleo DDB","2.1",6.2,"sim"
"1417","ANEEL-PD-00391-0029","Instrumentalização e Sistematização da Capacitação para Conselhos de Consumidores","nenhuma categoria encontrada",6.2,"sim"
"1418","ANEEL-PD-00382-0097","Medidor com Identificação de Violação","nenhuma categoria encontrada",6.2,"sim"
"1419","ANEEL-PD-00371-0002","Uso de Óleos Vegetais in Natura na Geração de Eletricidade nos Sistemas Isolados Regulados.","""3.4"", ""7.1""",3.4,"sim"
"1420","ANEEL-PD-00371-0012","Sistema Computacional para Avaliação Crítica de Dados de Telemedição de Consumidores de MT/AT de uma Concessionária de Energia: Prevenção de fraudes, avarias e redimensionamento de equipamentos","6.2",6.2,"sim"
"1421","ANEEL-PD-00371-0013","Sistema Computacional para Avaliação de Aspectos de Segurança do Sistema de Aterramento de Subestações","6.2",6.2,"sim"
"1422","ANEEL-PD-00371-0020","Metodologias para Detecção de Perdas no Sistema e Determinação de Parâmetros de Qualidade em Redes MT/BT Aderente às Recomendações do PRODIST","6.2",6.2,"sim"
"1423","ANEEL-PD-00391-0030","Sistema integrado para proteção da receita de clientes BT MI de alto risco","nenhuma categoria encontrada",6.2,"sim"
"1424","ANEEL-PD-00382-0098","Sistema de detecção da corrosão (SDC) para cabos CAA em linha energizada - Lote Pioneiro","6.2",6.2,"sim"
"1425","ANEEL-PD-00371-0003","Avaliação de Tecnologias de Comunicação para a Implantação de Monitoramento e Supervisão nos Sistemas de Geração e Distribuição das Centrais Elétricas do Pará.","6.2",6.2,"sim"
"1426","ANEEL-PD-00371-0007","MONITORAMENTO DOS POSSÍVEIS IMPACTOS DA LINHA DE TRANSMISSÃO DO MARAJÓ SOBRE A FAUNA","6.2",6.2,"sim"
"1427","ANEEL-PD-00371-0008","Desenvolvimento de um Sistema Computacional de seleção e Priorização de investimentos para a Otimização de Indicadores de Continuidade considerando as características regionais do Estado do Pará","nenhuma categoria encontrada",6.2,"sim"
"1428","ANEEL-PD-00382-0099","Sistema inteligente para tratamento de denúncia de fraude (SIDF)","nenhuma categoria encontrada",6.2,"sim"
"1429","ANEEL-PD-00371-0022","Sistema de Identificação de Perdas Comerciais e Técnicas Através de Sensoreamento Massivo","nenhuma categoria encontrada",6.2,"sim"
"1430","ANEEL-PD-00382-0100",": Projeto P&D - Desenvolvimento de materiais nanotecnológios para captura de gases em câmaras subterrâneas de sistemas de distribuição","6.2",6.2,"sim"
"1431","ANEEL-PD-00382-0101","Detecção de vazamentos de óleos em cabos subterrâneos Tipo OF","6.2",6.2,"sim"
"1432","ANEEL-PD-00382-0102","MODELAGEM DE INDICADORES DE DESEMPENHO EM EMPRESA DO SETOR ELÉTRICO: uma análise de desempenho à luz das linguagens contábil, econômica e financeira.","nenhuma categoria encontrada",6.2,"sim"
"1433","ANEEL-PD-00382-0103","Cabeça de serie de equipamento para balanço energético e qualidade de energia no combate às perdas em continuidade ao PD Light S_21_07","nenhuma categoria encontrada",6.2,"sim"
"1434","ANEEL-PD-00048-0214","Melhoria do Processo de Gestão de Dados Espaciais da CHESF baseado em uma Abordagem Semântica para Dados Espaciais 2D e 3D","nenhuma categoria encontrada",6.1,"sim"
"1435","ANEEL-PD-05160-1702","Metodologia para detecção de problemas em isoladores das redes de distribuição por Redes Neurais Profundas","6.2",6.2,"sim"
"1436","ANEEL-PD-00382-0037","Sistema sem fio de controle de iluminação","""1.4"", ""6.2""",1.2,"sim"
"1437","ANEEL-PD-00382-0049","Modelo de Valuation Estocástico para Apreçamento de Empresas do Setor Elétrico no Brasil","1.4",NA,"não"
"1438","ANEEL-PD-00373-0004","Sistema de Monitoramento de Falhas em Redes de Distribuição Baseado em Redes de Sensores sem Fio.","6.2",NA,"não"
"1439","ANEEL-PD-00373-0005","Desenvolvimento de metodologia para determinação, de forma estratificada, da perda não técnica de energia utilizando técnicas estatísticas.","nenhuma categoria encontrada",NA,"não"
"1440","ANEEL-PD-00373-0006","Sistema integrado e reconfigurável para automatização de testes e análise de medidores","7.1",NA,"não"
"1441","ANEEL-PD-00373-0015","Sistema de Suporte para a Projeção de Mercado para a Eletrobrás Amazonas Energia","7.1",NA,"não"
"1442","ANEEL-PD-00373-0011","Geração de Energia Elétrica com Etanol da Mandioca na Amazônia","3.4",3.4,"sim"
"1443","ANEEL-PD-00373-0010","Desenvolvimento de Modelo Referência para Empresas de Distribuição, fundamentado na experimentação de aplicações de conjunto de tecnologia SmartGrid, projeto piloto a ser implantado em Parintins-AM.","nenhuma categoria encontrada",1.4,"sim"
"1444","ANEEL-PD-08106-0001","Desenvolvimento e teste de sistema de monitoramento de estado de Chave Seccionadora de subestação por fibra óptica.","nenhuma categoria encontrada",6.2,"sim"
"1445","ANEEL-PD-08106-0002","SISTEMA ROBOTIZADO PARA INSPEÇÃO DE SUBESTAÇÕES DE ENERGIA ELÉTRICA.","nenhuma categoria encontrada",6.2,"sim"
"1446","ANEEL-PD-02866-0490","PESQUISA E DESENVOLVIMENTO DE CARREGADOR RÁPIDO NACIONAL PARA VEÍCULOS ELÉTRICOS (VE)","nenhuma categoria encontrada",1.3,"sim"
"1447","ANEEL-PD-00385-0065","Sistema solar fotovoltaico conectado diretamente à estrutura da rede secundária de distribuição","6.2",3.1,"sim"
"1448","ANEEL-PD-00385-0064","Desenvolvimento de um sistema solar hibrido para implementação do conceito Multisolar","nenhuma categoria encontrada",3.7,"sim"
"1449","ANEEL-PD-00382-0104","Sistema de detecção de fraude por meio de Random Forest","nenhuma categoria encontrada",6.2,"sim"
"1450","ANEEL-PD-06683-0118","Desenvolvimento de técnicas de deposição de revestimentos por aspersão térmica robotizada para redução de desgaste por erosão e cavitação em turbinas hidráulicas","3.1",3.6,"sim"
"1451","ANEEL-PD-00063-3036","PA3036 - Ergonomia, Biomecânica e Cibernética: Tecnologias para o Eletricista do Futuro: Contínuo Aumento de Produtividade com Melhoria do SSQV","nenhuma categoria encontrada",6.2,"sim"
"1452","ANEEL-PD-07469-0002","Desenvolvimento de sistema especialista para gestão de manutenção preditiva com simulação de politicas de gestão de ativos baseadas em modelos de análise de confiabilidade e impacto financeiro","7.1",3.6,"sim"
"1453","ANEEL-PD-00382-0105","Sistema Sensor de Vazamentos de Óleo em Cabos OF","""2.1"", ""6.2""",6.2,"sim"
"1454","ANEEL-PD-00382-0106","Determinação de Limites de Carregamento de Transformadores Levando em Conta Modelos Termodinâmicos e Análise Tridimensional (3D) - Continuação","6.2",6.2,"sim"
"1455","ANEEL-PD-00391-0031","Desenvolvimento de rede óptica de altíssima confiabilidade e multisserviços integrada à rede de distribuição compacta - OPDC","6.2",6.2,"sim"
"1456","ANEEL-PD-04950-0632","D0632-Veredas Sol e Lares - Uma Alternativa Para o Múltiplo Aproveitamento Energético em Reservatórios de Usinas Hidrelétricas na Região do Semiárido Mineiro","nenhuma categoria encontrada",3.7,"sim"
"1457","ANEEL-PD-00382-0002","Influência das Condições Climáticas no Mercado de Energia Elétrica da Light","7.1",7.1,"sim"
"1458","ANEEL-PD-00382-0050","Desenvolvimento de um sistema integrado multicritério para reconfiguração e planejamento da expansão de redes de distribuição de energia elétrica","""6.2"", ""7.1""",6.2,"sim"
"1459","ANEEL-PD-00063-3037","PA3037 - Aplicação de Machine Learning para redução de perdas e recuperação de receita","nenhuma categoria encontrada",6.2,"sim"
"1460","ANEEL-PD-05161-0006","ESTOCAGEM DE CARBONO, NITROGÊNIO E FÓSFORO NOS RESERVATÓRIOS DA LIGHT ENERGIA S.A.","nenhuma categoria encontrada",6.2,"sim"
"1461","ANEEL-PD-02866-0276","Controlador de Carga Pulsada Portátil Para Baterias de Sistemas Fotovoltaicos de Geração de Energia Elétrica","nenhuma categoria encontrada",3.1,"sim"
"1462","ANEEL-PD-07019-0019","Sistema Universal de Blindagem Anti Fraude para Medidores de Energia Elétrica","nenhuma categoria encontrada",6.2,"sim"
"1463","ANEEL-PD-07019-0020","Mini-estação para coleta, tratamento e reutilização de óleos lubrificantes em centrais termelétricas do interior do Estado do Amazonas","nenhuma categoria encontrada",6.2,"sim"
"1464","ANEEL-PD-07019-0025","AVAW - Alicate Voltímetro, Amperímetro e Wattímetro para rede de distribuição de Baixa e Média Tensão até 35kV","nenhuma categoria encontrada",6.2,"sim"
"1465","ANEEL-PD-07019-0028","Desenvolvimento de um Sistema Inteligente para Determinação dos Impactos Harmônicos de Múltiplos Consumidores Industriais nas Redes de Distribuição de Energia Elétrica","6.2",6.2,"sim"
"1466","ANEEL-PD-06509-0001","Operagco Monitorada de Turbinas Hidraulicas tipo Kaplan, por meio de um algoritmo com interface inteligente em redes neurais, com vistas a ampliar a faixa operacional dos grupos Turbina-geradores","""6.2"", ""7.1""",3.7,"sim"
"1467","ANEEL-PD-06509-0004","Operagco Monitorada de Turbinas Hidraulicas tipo Kaplan, por meio de um algoritmo com interface inteligente em redes neurais, com vistas a ampliar a faixa operacional dos grupos Turbina-geradores","""6.2"", ""7.1""",3.7,"sim"
"1468","ANEEL-PD-06509-0005","Operação Monitorada de Turbinas Hidráulicas tipo Kaplan, por meio de um algoritmo com interface inteligente em redes neurais, com vistas a ampliar a faixa operacional dos grupos Turbina-geradores","""6.2"", ""7.1""",3.7,"sim"
"1469","ANEEL-PD-06509-0006","Operação Monitorada de Turbinas Hidráulicas tipo Kaplan, por meio de um algoritmo com interface inteligente em redes neurais, com vistas a ampliar a faixa operacional dos grupos Turbina-geradores","""6.2"", ""7.1""",3.7,"sim"
"1470","ANEEL-PD-00097-1417","Unidade fotocatalítica para a conversão de CO2 e vapor d'água para produção de hidrocarbonetos combustíveis","nenhuma categoria encontrada",2.1,"sim"
"1471","ANEEL-PD-05160-1710","Geração Distribuída no Campus da Universidade de Brasília Integrada a Rede de Distribuição da CEB.","""6.2"", ""7.1""",7.1,"sim"
"1472","ANEEL-PD-00382-0108","Limitador de corrente de curto circuito híbrido para sistemas de distribuição","nenhuma categoria encontrada",6.2,"sim"
"1473","ANEEL-PD-00380-0027","Novos elementos de automação de rede, com funções avançadas de inteligência distribuída","6.2",6.2,"sim"
"1474","ANEEL-PD-04951-0581","Desenvolvimento de técnicas de bioengenharia de solos para drenagem superficial e controle de erosões lineares em linhas de transmissão e distribuição","6.2",6.2,"sim"
"1475","ANEEL-PD-06509-0007","Operação Monitorada de Turbinas Hidráulicas tipo Kaplan, por meio de um algoritmo com interface inteligente em redes neurais, com vistas a ampliar a faixa operacional dos grupos Turbina-geradores","""6.2"", ""7.1""",3.7,"sim"
"1476","ANEEL-PD-06509-0008","Operação Monitorada de Turbinas Hidráulicas tipo Kaplan, por meio de um algoritmo com interface inteligente em redes neurais, com vistas a ampliar a faixa operacional dos grupos Turbina-geradores","""6.2"", ""7.1""",3.7,"sim"
"1477","ANEEL-PD-00068-0039","Desenvolvimento de sistema integrado consolidando processos, metodologia, tecnologia para voo autonomo e tratamento de imagens na operação de drones em inspeção LTs, torres e faixas de servidão","nenhuma categoria encontrada",6.2,"sim"
"1478","ANEEL-PD-06509-0009","Operação Monitorada de Turbinas Hidráulicas tipo Kaplan, por meio de um algoritmo com interface inteligente em redes neurais, com vistas a ampliar a faixa operacional dos grupos Turbina-geradores","""6.2"", ""7.1""",3.7,"sim"
"1479","ANEEL-PD-00097-1517","Otimização e controle de propriedades de corpos cerâmicos produzidos à base de cinza pesada de carvão termoelétrico com vistas a utilização industrial","2.2",2.2,"sim"
"1480","ANEEL-PD-06509-0010","Operação Monitorada de Turbinas Hidráulicas tipo Kaplan, por meio de um algoritmo com interface inteligente em redes neurais, com vistas a ampliar a faixa operacional dos grupos Turbina-geradores","""6.2"", ""7.1""",3.7,"sim"
"1481","ANEEL-PD-06509-0011","Operação Monitorada de Turbinas Hidráulicas tipo Kaplan, por meio de um algoritmo com interface inteligente em redes neurais, com vistas a ampliar a faixa operacional dos grupos Turbina-geradores","""6.2"", ""7.1""",3.7,"sim"
"1482","ANEEL-PD-02866-0496","APRENDIZAGEM ORGANIZACIONAL EM ECOSSISTEMAS DE INOVAÇÃO ABERTA","nenhuma categoria encontrada",6.2,"sim"
"1483","ANEEL-PD-08196-0001","DESENVOLVIMENTO DE METODOLOGIA E SISTEMA INTELIGENTE DE INSPEÇÃO AUTOMÁTICA DE LINHAS DE TRANSMISSÃO EM 525KV","6.2",6.2,"sim"
"1484","ANEEL-PD-06509-0012","Operação Monitorada de Turbinas Hidráulicas tipo Kaplan, por meio de um algoritmo com interface inteligente em redes neurais, com vistas a ampliar a faixa operacional dos grupos Turbina-geradores","""6.2"", ""7.1""",3.7,"sim"
"1485","ANEEL-PD-00382-0110","Abordagem e sistema para suporte ao direcionamento de campo e cálculo de TOI para área de perdas","nenhuma categoria encontrada",6.2,"sim"
"1486","ANEEL-PD-00391-0032","Modernização das Tarifas de Distribuição de Energia Elétrica","nenhuma categoria encontrada",6.2,"sim"
"1487","ANEEL-PD-06509-0013","Operação Monitorada de Turbinas Hidráulicas tipo Kaplan, por meio de um algoritmo com interface inteligente em redes neurais, com vistas a ampliar a faixa operacional dos grupos Turbina-geradores","""6.2"", ""7.1""",3.7,"sim"
"1488","ANEEL-PD-00097-2317","Captura de CO2 para obtencao de nanotubos de carbono..","nenhuma categoria encontrada",2.3,"sim"
"1489","ANEEL-PD-00097-3617","Uso de fly-ash em tintas smart coatingï¿½:Um novo conceito na utilizacao de residuos agregando alto valor ..","nenhuma categoria encontrada",2.2,"sim"
"1490","ANEEL-PD-00382-0111","Previsão de Probabilidades de falhas e estimação de sinistros em estruturas, equipamentos e circuitos das redes de distribuição subterrâneas","6.2",6.2,"sim"
"1491","ANEEL-PD-04950-0580","Desenvolvimento e aplicação de metodologia de Governança de Dados e construção de arquitetura integrada p/ formação e gestão da base de dados regulatórios de uma concessionária de Distrib. de Energia","nenhuma categoria encontrada",6.2,"sim"
"1492","ANEEL-PD-04950-0583","Solução """"multi interface"""" bidirecional de conteúdos comerciais, institucionais e educativos","nenhuma categoria encontrada",NA,"não"
"1493","ANEEL-PD-00103-0003","Sistema Integrado para Monitoração de Perdas Elétricas e Modelagem de Carga em Redes de Distribuição Rurais","nenhuma categoria encontrada",6.2,"sim"
"1494","ANEEL-PD-04950-0585","Desenvolvimento de metodologia e sistema computacional WEB para otimização multicritério do portfólio de ações de cobrança","nenhuma categoria encontrada",6.2,"sim"
"1495","ANEEL-PD-04951-0588","Desenvolvimento de sistema computacional para o planejamento do despacho considerando múltiplos objetivos, com integrações e funcionalidades multi-usuários.","7.1",7.1,"sim"
"1496","ANEEL-PD-04950-0590","Cabeças de Série do Sistema Inteligente de Sensoriamento e Controle Avançado da Infraestrutura Elétrica","6.2",6.2,"sim"
"1497","ANEEL-PD-06491-0411","SUSTENTABILIDADE DA USINA TERMELÉTRICA: TRATAMENTO INTEGRADO DE EFLUENTES LIQUIDO, SOLIDO E GASOSO","nenhuma categoria encontrada",2.2,"sim"
"1498","ANEEL-PD-00383-0060","Desenvolvimento de rede móvel para distribuição de energia","""5.2"", ""6.2""",6.3,"sim"
"1499","ANEEL-PD-04950-0582","Arquitetura de referência de baixo custo para leitura e gerenciamento remoto de unidades consumidoras rurais dispersas","nenhuma categoria encontrada",6.2,"sim"
"1500","ANEEL-PD-04950-0584","Infraestrutura para testes de qualidade e interoperabilidade de equipamentos para AMI e Automação de Rede","nenhuma categoria encontrada",6.2,"sim"
"1501","ANEEL-PD-04951-0641","GT0641-Proposta de uma Metodologia de Busca de Informações e Estimativa de Demanda e Consumo de Clientes Livres Potenciais""""","7.1",NA,"não"
"1502","ANEEL-PD-06585-1802","Análise Estocástica de Perdas Técnicas em Sistemas de Energia","nenhuma categoria encontrada",6.2,"sim"
"1503","ANEEL-PD-04951-0597","PAEplay - A ferramenta de apoio ao treinamento contínuo nos procedimentos de monitoramento do estado das barragens da CEMIG e de utilização do PAE","nenhuma categoria encontrada",6.2,"sim"
"1504","ANEEL-PD-04951-0596","CS Cabeça de Série do Sistema de Registro de Informações Gerenciais (SRIG) desenvolvido no projeto PD-4951-0335/2010 (CEMIG GT335)","6.2",6.2,"sim"
"1505","ANEEL-PD-00404-1803","Desenvolvimento de uma nova metodologia para quantificação das perdas técnicas da distribuição em condições distorcidas e desequilibradas","nenhuma categoria encontrada",6.2,"sim"
"1506","ANEEL-PD-06683-0218","Biomonitoramento e controle Integrado de macrófitas e mosquitos do gênero Mansonia (Diptera: Culicidae) em região associada a lago de Usina Hidrelétrica (UHE)","3.6",6.1,"sim"
"1507","ANEEL-PD-04951-0646","GT0646-Nova metodologia de aplicação de percentual de constituição de servidão administrativa""""","nenhuma categoria encontrada",NA,"não"
"1508","ANEEL-PD-00382-0112","Sistema de Planejamento e Monitoramento da Manutenção de Redes de Distribuição de Energia Elétrica.","""6.2"", ""7.1""",6.2,"sim"
"1509","ANEEL-PD-04950-0640","D0640-Modelo de Referência para a Rede Operativa de Dados da CEMIG","6.2",6.2,"sim"
"1510","ANEEL-PD-00097-2517","Desenvolvimento de Suportes para Liberacao Controlada de Agroquimicos a partir de Nano-carbonatos Oriundos da Captura do CO2 - Projeto AgriCarbono","nenhuma categoria encontrada",2.3,"sim"
"1511","ANEEL-PD-04950-0600","Metodo de ranqueamento de investimento","nenhuma categoria encontrada",6.2,"sim"
"1512","ANEEL-PD-04951-0643","GT0643-Geração de Eletricidade Descentralizada a Partir dos Gases Residuais da Carbonização","7.1",3.7,"sim"
"1513","ANEEL-PD-02866-0430","MODELO MATEMÁTICO E ALGORITMO COMPUTACIONAL AVANÇADOS PARA DIMENSIONAMENTO OTIMIZADO DE EQUIPES E RECURSOS DE MANUTENÇÃO EM DISTRIBUIÇÃO DE ENERGIA ELÉTRICA","7.1",6.2,"sim"
"1514","ANEEL-PD-04951-0605","Sistema para Videomonitoramento Operacional de Chaves Seccionadoras de Subestações e Vertedouros de Usinas Hidroelétricas com Tratamento Avançado de Imagens","nenhuma categoria encontrada",6.2,"sim"
"1515","ANEEL-PD-02866-0422","DESENVOLVIMENTO DE METODOLOGIA PARA A OBTENÇÃO DA EMISSIVIDADE E ABSORTIVIDADE DE CONDUTORES DE LINHAS DE TRANSMISSÃO EM CONDIÇÃO REAL DE OPERAÇÃO","6.2",6.2,"sim"
"1516","ANEEL-PD-00068-0042","Contribuições metodológicas para definição de custo de capital regulatório para o setor de transmissão de eletricidade no Brasil","""6.2"", ""7.1""",6.2,"sim"
"1517","ANEEL-PD-00097-3317","Utilizacao de residuo FGD para fabricacao de geopolimero visando a obtencao de elementos estruturais da construcao","3.4",2.3,"sim"
"1518","ANEEL-PD-00405-1805","Desenvolvimento de uma Plataforma de Observabilidade Avançada da Rede de Distribuição de Energia Elétrica ..","6.2",6.2,"sim"
"1519","ANEEL-PD-04950-0586","Modelo Regulatório adequado para implantação da Mini e Micro Geração Distribuida com preservação da Receita Requerida da distribuidora e em benefício da sociedade.","nenhuma categoria encontrada",3.7,"sim"
"1520","ANEEL-PD-04950-0606","CS -- Desenvolvimento de Religador Monofásico à Vácuo Aplicados em Redes Rurais","6.2",6.2,"sim"
"1521","ANEEL-PD-04950-0613","CEMIG D566 Continuidade Fase II: Desenvolvimento de redes sinérgicas para aplicações em redes de distribuição de energia","6.2",6.2,"sim"
"1522","ANEEL-PD-00068-0040","Desenvolvimento de Sistema de Monitoramento e Gestão Sustentável de Faixas de Servidão","nenhuma categoria encontrada",6.2,"sim"
"1523","ANEEL-PD-00068-0041","Desenvolvimento de Sistemas e Métodos de Gestão Enxuta de Projetos de PeD para Alavancar a Inovação no Setor Elétrico","nenhuma categoria encontrada",6.2,"sim"
"1524","ANEEL-PD-00381-0009","Aperfeiçoamento da Estrutura das Tarifas de Energia Elétrica no Brasil","nenhuma categoria encontrada",6.2,"sim"
"1525","ANEEL-PD-00372-9988","Desenvolvimento de um sistema de monitoramento com prognóstico e diagnóstico integrado da função geração de energia elétrica para usinas hidrelétricas","6.2",6.2,"sim"
