"","id","titulo_projeto","categorias","cat2","existe"
"561","ANEEL-PD-05697-7012","Redefinição de Limites de Máximo Carregamento Admissível de Redes Compactas Utilizando Modelos Dinâmicos.","6.2",6.2,"sim"
"562","ANEEL-PD-05697-7112","Sistema Integrado para Simulação da Detecção e Diagnóstico de Faltas em Alimentadores de Redes Compactas: Algoritmos, Plataforma de Simulação e Testes de Desempenho","""6.2"", ""7.1""",6.2,"sim"
"563","ANEEL-PD-05697-7412","Desenvolvimento de indicadores termo-sensíveis para indicação por inspeção visual do estado de degradação de conexões das redes aéreas de distribuição.","6.2",6.2,"sim"
"564","ANEEL-PD-05697-7312","Desenvolvimento de Procedimento e Ferramenta Computacional para Avaliação da Viabilidade da Recuperação de Trafo de Distribuição considerando Aspectos Técnicos, Econômicos e Regulatórios.","6.2",NA,"não"
"565","ANEEL-PD-05697-7512","Desenvolvimento de soluções inéditas para a repotenciação de subestações minimizando desligamentos.","nenhuma categoria encontrada",NA,"não"
"566","ANEEL-PD-05697-7612","Sistema de cálculo para otimização do carregamento de condutores de redes aéreas de média de tensão com cabos isolados e cobertos.","6.2",6.2,"sim"
"567","ANEEL-PD-05697-7812","Sistema especialista para controle de carregamento dinâmico de alimentadores subterrâneos, multiplamente acoplado, da saída de Subestação.","6.2",NA,"não"
"568","ANEEL-PD-05697-7712","Desenvolvimento de soluções tecnológicas para a fabricação de ferragens metálicas de redes aéreas, para uso em regiões críticas, incluindo a orla marinha, fazendo uso de modelo físico simplificado","nenhuma categoria encontrada",6.2,"sim"
"569","ANEEL-PD-05697-7912","AVALIAÇÃO DA GERAÇÃO DE ENERGIA A PARTIR DA BIOMASSA COMPOSTA E GAS NATURAL","""2.1"", ""3.4""",NA,"não"
"570","ANEEL-PD-05697-8112","Protótipo de sistema de iluminação pública com alimentação redundante e opções de controle de modo individualizado e integrado","""1.4"", ""6.2""",NA,"não"
"571","ANEEL-PD-05697-8212","Iluminação Pública eficiente, inteligente e renovável","1.4",NA,"não"
"572","ANEEL-PD-05697-8312","Desenvolvimento de Cruzetas para Redes de Distribuição a Partir da Madeira Reconstituída pela Técnica MLC","6.2",NA,"não"
"573","ANEEL-PD-05697-8512","Formulação de metodologia para a análise da operação das Linhas de Transmissão da CELESC em base estatística","""1.4"", ""6.2""",NA,"não"
"574","ANEEL-PD-05697-8712","Desenvolvimento de Sensores Térmicos Baseados em Cristais Líquidos para Detecção de Pontos Quentes e Elevadas Correntes de Fuga em Equipamentos do Sistema de Distribuição","6.2",6.2,"sim"
"575","ANEEL-PD-05697-8412","Metodologia para otimização das manobras do sistema de média tensão para apoio à operação em tempo real","nenhuma categoria encontrada",NA,"não"
"576","ANEEL-PD-05697-8912","MITIGAÇÃO DO CONFLITO ENTRE A FAUNA E REDE DE DISTRIBUIÇÃO DE ENERGIA ELÉTRICA NO MUNICÍPIO DE BLUMENAU SANTA CATARINA.","6.2",NA,"não"
"577","ANEEL-PD-05697-8812","Desenvolvimento de um sistema e/ou ferramenta que automatize o processo de monitoramento, de avaliação sócio-patrimonial e ambiental das usinas de geração, utilizando técnicas de geoprocessamento.","""1.4"", ""6.2""",NA,"não"
"578","ANEEL-PD-05697-9012","Desenvolvimento de novo processo e nova metodologia baseados em micro-ondas para reciclagem de resíduos de filtragem de óleo mineral isolante (OMI).","""2.1"", ""3.3""",3.4,"sim"
"579","ANEEL-PD-05697-9112","DESENVOLVIMENTO DE METODOLOGIAS PARA GESTÃO SOCIOAMBIENTAL DE CORREDORES DE TRANSMISSÃO DE ENERGIA ELÉTRICA","6.2",6.2,"sim"
"580","ANEEL-PD-05697-9212","DESENVOLVIMENTO DE METODOLOGIAS PARA QUANTIFICAÇÃO DE CUSTOS SOCIOAMBIENTAIS DE REDES ELÉTRICAS","nenhuma categoria encontrada",NA,"não"
"581","ANEEL-PD-05697-9512","PRENSAGEM ISOSTÁTICA: REDUÇÃO DO CONSUMO ENERGÉTICO E DO IMPACTO AMBIENTAL NA PRODUÇÃO DE ISOLADORES ELÉTRICOS","1.4",1.4,"sim"
"582","ANEEL-PD-05697-9712","Sistema georeferenciado de controle patrimonial e sócio-ambiental de uma  PCH em Santa Catarina.","""3.6"", ""6.2""",NA,"não"
"583","ANEEL-PD-05697-9912","Avaliação da disposição controlada de resíduos da suinocultura em sistema landfarming para a bioremediação de solos contaminados por óleo de tranformador","""2.1"", ""6.2""",3.4,"sim"
"584","ANEEL-PD-05697-0213","REAPROVEITAMENTO DE ISOLADORES PORCELÂNICOS E DE VIDRO","nenhuma categoria encontrada",NA,"não"
"585","ANEEL-PD-05697-0313","Construção de uma metodologia aplicável aos programas educacionais no contexto do processo de licenciamento ambiental de redes elétricas e subestações","nenhuma categoria encontrada",NA,"não"
"586","ANEEL-PD-05697-0113","Redução dos efeitos de eventos climáticos extremos através de Programa de Gestão Multidisciplinar de Ações Preventivas e Corretivas no Sistema Elétrico","7.1",6.2,"sim"
"587","ANEEL-PD-00402-2111","Desenvolvimento de um protótipo de célula a combustível de óxido sólido (CCOS) para geração de energia elétrica.","5.2",NA,"não"
"588","ANEEL-PD-05697-3212","Desenvolvimento de um Parque Eólico em Polímeros que possa ser instalado em pequenas áreas com fluxo reduzido de vento","nenhuma categoria encontrada",NA,"não"
"589","ANEEL-PD-04950-0443","D443 - PA - Desenvolvimento de Modelo Explicativo dos Acidentes de Trabalho na Cemig através de Coleta e Análise de Variáveis Comportamentais,","nenhuma categoria encontrada",6.2,"sim"
"590","ANEEL-PD-04951-0464","GT464 - PA - Previsões de chuva para horizontes de 3 dias e de 4 meses detalhadas para bacias hidrográficas brasileiras.","1.4",1.4,"sim"
"591","ANEEL-PD-04950-0309","D309 - PA - Desenvolvimento de uma Metodologia Experimental em Túnel de Vento e Numérica para Avaliação do Comportamento Elétrico e Mecânico de Condutores em função de sua Geometria e Escoamentos.","""1.4"", ""6.2""",1.4,"sim"
"592","ANEEL-PD-04950-0439","D439 - DE - Desenvolvimento de soluções inovadoras para viabilização de agências de atendimento com soluções automatizadas para os consumidores da Cemig, incluindo pessoas com deficiências diversas","nenhuma categoria encontrada",6.2,"sim"
"593","ANEEL-PD-02866-0258","Avaliação do óleo de crambe como fluído isolante em transformadores e desenvolvimento agroindustrial da cultura","""2.1"", ""6.2""",3.4,"sim"
"594","ANEEL-PD-04950-0319","D319 - PA - Monitoração remota de linhas de transmissão com redes de sensores sem fio.","6.2",6.2,"sim"
"595","ANEEL-PD-00040-0017","EMULADOR MÓVEL DE PROTEÇÃO E MANOBRA EM MÉDIA TENSÃO, COM FUNCIONALIDADES APLICÁVEL EM SUBESTAÇÕES NO SMART GRID","""5.2"", ""6.2""",NA,"não"
"596","ANEEL-PD-00040-0018","RESINA HIDROREPELENTE PARA COBERTURA DE ESTRUTURAS DE CONCRETO, USANDO RESIDUOS PLASTICOS RECICLAVEIS","nenhuma categoria encontrada",3.4,"sim"
"597","ANEEL-PD-04950-0369","D369 - PA - Planejamento e Operação da Reconfiguração de Sistemas de Distribuição Utilizando Algoritmos de Otimização.","""6.2"", ""7.1""",6.2,"sim"
"598","ANEEL-PD-04950-0463","GT463 - PA - Desenvolvimento de metodologia e ferramentas computacionais multicritério para operação ótima de usinas hidrelétricas","1.4",1.4,"sim"
"599","ANEEL-PD-00039-0067","AUTOECOELCE - Plataforma Autônoma para Logística Reversas de Resíduos Sólidos Domésticos","1.4",3.4,"sim"
"600","ANEEL-PD-04951-0463","GT463 - PA - Desenvolvimento de metodologia e ferramentas computacionais multicritério para operação ótima de usinas hidrelétricas","1.4",1.4,"sim"
"601","ANEEL-PD-00043-0112","Transferência e Corte Seletivo Através do Gerenciamento Otimizado de Cargas.","nenhuma categoria encontrada",6.2,"sim"
"602","ANEEL-PD-04950-0425","D425 - PA - DESENVOLVIMENTO DE METODOLOGIA PARA ANÁLISE DOS IMPACTOS DA INTEGRAÇÃO DE VEÍCULO ELÉTRICOS À REDE DE DISTRIBUIÇÃO","""6.2"", ""7.1""",7.1,"sim"
"603","ANEEL-PD-00048-1123","Desenvolvimento de um Aplicativo de Diagnóstico Automático de Perturbação e Análise de Desempenho para os Sistemas de Controle e Proteção.","6.2",6.2,"sim"
"604","ANEEL-PD-00047-0061","Ferramenta para Mitigação dos Riscos de Perdas de Competências Técnicas e Operacionais","nenhuma categoria encontrada",NA,"não"
"605","ANEEL-PD-00047-0063","Investigação do efeito hidrofugante de resíduos de silicone e fibras orgânicas para a confecção de cruzetas e postes celulares, com armaduras em material compósito, monitoradas por fibra ótica","nenhuma categoria encontrada",NA,"não"
"606","ANEEL-PD-00047-0062","Desenvolvimento de ferramental, equipamentos e metodologia para realização de poda com rede energizada em áreas urbanas através de braços mecânicos com comando remoto","nenhuma categoria encontrada",6.2,"sim"
"607","ANEEL-PD-04950-0364","D364 - PB - Desenvolvimento de metodologia para diagnóstico de insanidade de árvores urbanas quanto a risco de quedas e risco elétrico.","nenhuma categoria encontrada",6.2,"sim"
"608","ANEEL-PD-00047-0064","Sistema de Operação Remota de Subestações Auxiliada pelas Imagens dos Equipamentos","nenhuma categoria encontrada",NA,"não"
"609","ANEEL-PD-00039-0068","Modelo de negocio para venda de energia pré-paga, via cartão de serviços, para consumidores residenciais de baixa renda","nenhuma categoria encontrada",6.2,"sim"
"610","ANEEL-PD-00047-0066","Arranjos técnicos e comerciais de geração de energia a partir do biogás proveniente de reatores anaeróbicos de estações de tratamento de esgoto","3.4",3.4,"sim"
"611","ANEEL-PD-00047-0065","Geração de Energia Elétrica com Resíduos Sólidos Urbanos: Implantação de projeto piloto e proposição de modelagens para viabilidade técnico-econômica e sustentabilidade socioambiental da tecnologia","nenhuma categoria encontrada",NA,"não"
"612","ANEEL-PD-00390-1063","Sistema de Mensagens Celular (SMS) para Facilitação de Pagamentos","nenhuma categoria encontrada",6.2,"sim"
"613","ANEEL-PD-00396-0034","Desenvolvimento de dispositivo para Corte e Religamento no Ramal de Ligação a distância","nenhuma categoria encontrada",6.2,"sim"
"614","ANEEL-PD-00047-0067","Desenvolvimento de etiqueta RFID com durabilidade superior a 25 anos em ambiente externo a ser instalada em equipamentos da rede de distribuição","nenhuma categoria encontrada",6.2,"sim"
"615","ANEEL-PD-00390-1065","Estudo e Análise no Dimensionamento das Malhas de Terra e de Neutro Considerando as Freqüências que Influenciam no Comportamento das Diversas Topologias em Sistemas Subterrâneos","6.2",6.2,"sim"
"616","ANEEL-PD-00390-1064","Determinação de Padrões de Sinais associados a Faltas de Alta Impedância utilizando Oscilografias de Janela de Tempo Ilimitada - Pesquisa e Aplicação","3.1",6.2,"sim"
"617","ANEEL-PD-00390-1066","Interruptor de ramal de ligação para corte e religação do fornecimento de energia","nenhuma categoria encontrada",6.2,"sim"
"618","ANEEL-PD-04951-0344","GT344 - DE - Modelos de recuperação, sustentabilidade e fixação de carbono das matas ciliares das margens de reservatórios.","nenhuma categoria encontrada",6.1,"sim"
"619","ANEEL-PD-00390-1067","Lote Pioneiro e Inserção no Mercado de Regulador de Tensão Portátil para Baixa Tensão e Sistema de Análise de Reclamação de Tensão","7.1",6.2,"sim"
"620","ANEEL-PD-00047-0068","Planejamento integrado da distribuição no âmbito das redes elétricas inteligentes com controle de qualidade de energia elétrica","""6.2"", ""7.1""",NA,"não"
"621","ANEEL-PD-00047-0069","Sensores de integridade física da rede aérea de distribuição para alarme, bloqueio do religamento e abertura do disjuntor.","6.2",NA,"não"
"622","ANEEL-PD-00047-0071","Desenvolvimento de Coberturas Rígidas Fotoluminescente e/ou Fosforescentes para realização de atividades em Linha Viva Noturna","nenhuma categoria encontrada",6.2,"sim"
"623","ANEEL-PD-00047-0070","Projeto Cabeça de série de ferramenta hidráulica para aplicação de conector tipo cunha, ferramenta para corte de cabos e aplicador de conexão de pressão","nenhuma categoria encontrada",6.2,"sim"
"624","ANEEL-PD-00068-0033","Modelagem de VSC (Voltage Sourced Converter) em redes interligadas HVDC em malha","6.2",6.2,"sim"
"625","ANEEL-PD-00043-0212","Projeto, Construção e Avaliação de Desempenho de um Restaurador Dinâmico de Tensão (Dynamic Voltage Restorer - DVR) de Baixo Custo","6.2",6.2,"sim"
"626","ANEEL-PD-00040-0019","ALGORITMO PARA SIMULAÇÃO DE SELETIVIDADE POTENCIALIZADO COM TÉCNICA DE OTIMIZAÇÃO DISCRETA RESTRITA, CUSTOMIZADO PARA AJUSTE E COORDENAÇÃO DA PROTEÇÃO DA DISTRIBUIÇÃO","""6.2"", ""7.1""",NA,"não"
"627","ANEEL-PD-00390-1068","Metodologia para análise de viabilidade de Projetos de PDeI (Pesquisa, Desenvolvimento e Inovação), considerando ganhos intangíveis.","nenhuma categoria encontrada",6.2,"sim"
"628","ANEEL-PD-00700-0112","Software para gerenciamento do risco meteorológico na operação de pequenas centrais hidrelétricas","nenhuma categoria encontrada",NA,"não"
"629","ANEEL-PD-04950-0329","D329 - CS - Ferramentas para suporte à manutenção dos ativos das empresas de energia elétrica em regiões de difícil acesso","6.2",6.2,"sim"
"630","ANEEL-PD-00047-0072","Produção Lote Pioneiro de Sensor Inteligente","6.2",6.2,"sim"
"631","ANEEL-PD-00047-0073","Novas ferramentas para operação e análise de índices de qualidade do sistema elétrico considerando a incidência de descargas atmosféricas em tempo real","nenhuma categoria encontrada",6.2,"sim"
"632","ANEEL-PD-00402-1711","Desenvolvimento de Padrões e Arranjo Físico  para Calibração de Medidores de Campo Elétrico e Magnético de Baixa Frequência Utilizados em Linhas de Transmissão e Subestações","6.2",NA,"não"
"633","ANEEL-PD-00414-0001","Desenvolvimento de Metodologia para Inspeção e Substituição de Isoladores Poliméricos com as Instalações Energizadas.","nenhuma categoria encontrada",6.2,"sim"
"634","ANEEL-PD-00047-0074","Geo Plataforma de Análise, Modelagem e Previsão de  Mercado de Consumo de Baixa Renda","7.1",NA,"não"
"635","ANEEL-PD-00401-0002","Transformador de distribuição de elevada eficiência e reduzida relação peso/potência empregando núcleo amorfo, óleo vegetal isolante e simulações em CFD para otimização do sistema de resfriamento","""1.1"", ""1.4"", ""2.1"", ""6.2""",1.2,"sim"
"636","ANEEL-PD-06585-1207","Desenvolvimento de aplicativo mobile para auto atendimento dos consumidores","nenhuma categoria encontrada",6.2,"sim"
"637","ANEEL-PD-00402-1811","Sistema Autônomo com Deslocamento pelos Cabos Para Raios para Inspeção de LTs e Faixas de Servidão por Scanner a Laser.","nenhuma categoria encontrada",NA,"não"
"638","ANEEL-PD-05785-2105","Desenvolvimento de sistema de produção de Biocombustível para uso em frota cativa e geradores","nenhuma categoria encontrada",NA,"não"
"639","ANEEL-PD-05785-2106","SISTEMA DE IDENTIFICAÇÃO DE CENÁRIOS ÓTIMOS PARA A CONVERSÃO DE ENERGIA EÓLICA E EÓLICA SUBMARINA NA REGIÃO SUL DO BRASIL","3.2",NA,"não"
"640","ANEEL-PD-05785-2112","Software Dinâmico de avaliação do potencial eólico para o Rio Grande do Sul","nenhuma categoria encontrada",NA,"não"
"641","ANEEL-PD-00047-0075","Desenvolvimento e implantação de solução técnica de alimentação elétrica alternativa para energização de dispositivos semafóricos","nenhuma categoria encontrada",6.2,"sim"
"642","ANEEL-PD-05785-2133","Desenvolvimento de um software dinâmico para geração de cenários otimizados para a compra e venda de energia nos ambientes de comercialização (W2S2)","7.1",7.1,"sim"
"643","ANEEL-PD-05785-2134","Desenvolvimento de Revestimentos Inteligentes (Smart Coatings) para Proteção à Corrosão e Aumento da Vida Útil de Condutos Forçados Metálicos","6.2",NA,"não"
"644","ANEEL-PD-05785-2102","Gerador Hidrocinético","nenhuma categoria encontrada",NA,"não"
"645","ANEEL-PD-05785-2131","Maximização da Potência e Rendimento de Centrais Fotovoltaicas Conectadas à Rede Usando Rastreamento Solar, Concentradores Planos e Condicionamento Geotérmico","6.2",NA,"não"
"646","ANEEL-PD-05785-2129","Controle da produção e estocagem dos gases da geração de energia elétrica para injeção na rede usando células a combustível visando maior rendimento","6.2",NA,"não"
"647","ANEEL-PD-05785-2116","Modelagem de Alta Resolução Aplicada a Estimativa de Vento na Camada Limite Planetária","3.1",NA,"não"
"648","ANEEL-PD-05785-2130","Sistema Para Simulação Meteorológica para Determinação Ótima da Localização de Parques Eólicos","7.1",NA,"não"
"649","ANEEL-PD-05707-2301","Localização de Faltas Temporárias em Sistemas Elétricos de Distribuição","6.2",NA,"não"
"650","ANEEL-PD-05707-2302","Estudo e Desenvolvimento de Metodologia Ótima para Projeto e Alocação de Dispositivos Limitadores de Correntes de Curto-Circuito em Sistemas de Distribuição de Energia","6.2",NA,"não"
"651","ANEEL-PD-05707-2303","Desenvolvimento de processo para detecção, quantificação, descontaminação e eliminação de bifenilas policloradas (PCBs) no óleo isolante de transformadores e demais equipamentos elétricos.","2.1",6.2,"sim"
"652","ANEEL-PD-05785-2132","Sistemas de baixo custo para simulação meteorológica na localização de parques eólicos","nenhuma categoria encontrada",NA,"não"
"653","ANEEL-PD-05707-2306","Sistema inovador para a obtenção de curvas de referencia para análise automática de sobretensões transitórias devido a chaveamentos considerando o tipo de alimentador predominante na CEEE-D","7.1",NA,"não"
"654","ANEEL-PD-05707-2308","Metodologia Inovadora para Antecipação de Falhas em Transformadores","6.2",NA,"não"
"655","ANEEL-PD-05707-2315","Transformador de distribuição baseado na tecnologia de estado sólido empregando conversores multiníveis","6.2",6.2,"sim"
"656","ANEEL-PD-05785-2126","METODOLOGIA DE OTIMIZAÇÃO E AVALIAÇÃO DO FATOR DE CAPACIDADE NO PROJETO DE PARQUES EÓLICOS EMPREGANDO A DINÂMICA DOS FLUIDOS COMPUTACIONAL","nenhuma categoria encontrada",NA,"não"
"657","ANEEL-PD-05785-2128","Pesquisa aplicada à avaliação do Programa de Educação Ambiental da CEEE GT (PEAGT)","nenhuma categoria encontrada",NA,"não"
"658","ANEEL-PD-00047-0076","Sistema Inteligente para Suporte a Decisões do Centro de Operação da Distribuição por meio de Plataforma de Interoperabilidade Smartgrid","nenhuma categoria encontrada",NA,"não"
"659","ANEEL-PD-00385-0061","Desenvolvimento de sistema de detecção da intrusão de vegetação em linhas de distribuição da ELEKTRO","6.2",NA,"não"
"660","ANEEL-PD-05707-2323","CEEE-iLOC: Sistema inovador para a localização de faltas temporárias, fraudes e furtos em sistemas elétricos de distribuição","6.2",6.2,"sim"
"661","ANEEL-PD-05707-2325","Sistema para captação, transmissão e distribuição de luz solar direta e difusa","""1.4"", ""6.2""",NA,"não"
"662","ANEEL-PD-05707-2326","Modelo elétrico do transformador obtido a partir do ensaio de Análise em Varredura da Resposta em Frequência como proposta de metodologia inovadora para a antecipação de falhas em transformadores","6.2",6.2,"sim"
"663","ANEEL-PD-05707-2328","Proposta de dimensionamento de Limitador de Corrente Supercondutor a partir do estudo e caracterização de supercondutor de alta temperatura crítica","""3.1"", ""6.2""",NA,"não"
"664","ANEEL-PD-05785-2117","Otimização Estocástica Interativa para a Contratação de Energia Elétrica sob Múltiplos Cenários quanto às Condições de Oferta, Mercado e Riscos","7.1",NA,"não"
"665","ANEEL-PD-05785-2127","Desenvolvimento de Máquina de Indução de Rotor Gaiola como Gerador de Alto Fator de Potência para Operação Interligada ou Isolada - Projeto GIRG","3.2",NA,"não"
"666","ANEEL-PD-00385-0058","Prognóstico para Manutenção Preditiva dos Ativos de Subestações","6.2",NA,"não"
"667","ANEEL-PD-05785-2120","Modelo econômico-probabilístico para avaliação dos impactos socioambientais em projetos de empreendimentos de sistemas de energia elétrica","nenhuma categoria encontrada",NA,"não"
"668","ANEEL-PD-05785-2123","SISTEMA DE MODELAGEM DE PLANEJAMENTO E GESTÃO ENFOCANDO O LADO DA OFERTA E DEMANDA DE ENERGIA PARA COMERCIALIZAÇÃO DE ENERGIA","7.1",NA,"não"
"669","ANEEL-PD-05785-2122","Valorização energética de resíduos sólidos urbanos: análise da quantidade de energia contida no lixo e da exequibilidade de seu uso como combustível em usinas termelétricas convencionais","nenhuma categoria encontrada",NA,"não"
"670","ANEEL-PD-05785-2121","Desenvolvimento de um sistema inovador para a criação de cenários otimizados para a venda de energia nos ambientes de comercialização.","7.1",NA,"não"
"671","ANEEL-PD-05785-2124","PROCESSO INTEGRADO DE CONVERSÃO DE BIOMASSA EM HIDROGÊNIO","""3.4"", ""5.1""",NA,"não"
"672","ANEEL-PD-04951-0486","GT- 486 Projeto de Pesquisa Controle da Qualidade das Águas e Revitalização do Rio Grande","nenhuma categoria encontrada",6.1,"sim"
"673","ANEEL-PD-04951-0485","GT485 - Projeto de Pesquisa e Controle da Qualidade das Águas do Programa de Revitalização do Rio São Francisco.","nenhuma categoria encontrada",NA,"não"
"674","ANEEL-PD-05785-2204","Desenvolvimento de uma metodologia para mitigação de desarmes da proteção de linhas de transmissão, baseada nas condições de operação, climáticas e ambientais.","6.2",NA,"não"
"675","ANEEL-PD-05785-2206","DESENVOLVIMENTO DE UMA METODOLOGIA PARA IDENTIFICAÇÃO DE SUPERAÇÃO DE EQUIPAMENTOS DE SUBESTAÇÕES APLICANDO TÉCNICAS ALTERNATIVAS PARA CÁLCULO DA TRT COM VELOCIDADE COMPATÍVEL AOS ESTUDOS EM MASSA","nenhuma categoria encontrada",NA,"não"
"676","ANEEL-PD-05707-2307","Sistema para identificação e previsão de áreas da rede de distribuição (MT e BT) com problemas de nível de tensão em regime permanente, considerando incertezas e com apoio em medições esparsas","6.2",NA,"não"
"677","ANEEL-PD-05707-2310","Processo e protótipo: Identificação de perdas comerciais na nova realidade da medição eletrônica, automação da distribuição e microgeração distribuída","nenhuma categoria encontrada",NA,"não"
"678","ANEEL-PD-05707-2311","Sistema Inovador para Projeto Otimizado de Aterramento de Estações de Telecomunicação Embutido em Concreto Associado à Utilização de Novos Materiais, Simulação Numérica e Modelagem TLM","6.2",NA,"não"
"679","ANEEL-PD-05707-2312","Transformador de Estado Sólido para Sistema de Distribuição","""6.2"", ""7.1""",NA,"não"
"680","ANEEL-PD-05707-2316","DESENVOLVIMENTO DE UMA METODOLOGIA PARA O ESTABELECIMENTO DE CURVAS DE REFERENCIA E ANÁLISE AUTOMÁTICA DE SOBRETENSÕES TRANSITÓRIAS DEVIDO A MANOBRAS EM SISTEMAS DE DISTRIBUIÇÃO DE ENERGIA ELÉTRICA","nenhuma categoria encontrada",NA,"não"
"681","ANEEL-PD-05707-2313","Desenvolvimento de técnica investigativa e complementar de análise do óleo mineral isolante para confirmação e localização de falhas em transformadores de potencia","""2.1"", ""6.2""",6.2,"sim"
"682","ANEEL-PD-05707-2320","Diagnóstico Inteligente de Falha em Transformadores por Resposta em Frequência","6.2",NA,"não"
"683","ANEEL-PD-05707-2324","SMART QUADRO","nenhuma categoria encontrada",NA,"não"
"684","ANEEL-PD-05707-2322","Sistema Inteligente de Identificação de Faltas em Sistemas de Distribuição","6.2",NA,"não"
"685","ANEEL-PD-05707-2330","Desenvolvimento de Protótipo de Transformador de Estado Sólido","""1.4"", ""6.2""",NA,"não"
"686","ANEEL-PD-05707-2327","FERRAMENTA COMPUTACIONAL DE BAIXO CUSTO PARA LOCALIZAÇÃO DE FALTAS TEMPORÁRIAS EM REDES DE DISTRIBUIÇÃO NA PLATAFORMA GOOGLE EARTH POR MEIO DE EQUAÇÕES DIFERENCIAIS E CONHECIMENTO HEURÍSTICO","6.2",NA,"não"
"687","ANEEL-PD-05707-2318","OTIMATER Projeto Ótimo de Sistema de Aterramento para Estações de Comunicação","6.2",NA,"não"
"688","ANEEL-PD-05707-2319","Sistema de Sinalização Remota de Falhas de Isoladores em Estruturas de Média e Alta Tensão utilizando ultrassom e radiofrequência de baixo custo","3.1",NA,"não"
"689","ANEEL-PD-05707-2305","Desenvolvimento de modelos probabilísticos para perda não técnica de energia, calculada a partir de amostragem estatística, avaliando a sua associação com variáveis regionais sócio-econômicas","nenhuma categoria encontrada",NA,"não"
"690","ANEEL-PD-05707-2317","Desenvolvimento transdutor de alta tensão com emprego de transformador piezoelétrico","""3.1"", ""6.2""",NA,"não"
"691","ANEEL-PD-05707-2329","Energia geotérmica superficial para condicionamento de ar visando à eficiência energética","""1.4"", ""3.5""",NA,"não"
"692","ANEEL-PD-00385-0060","Sistema de Treinamento 3D para Operadores Responsáveis por Manutenção de Subestação da ELEKTRO.","nenhuma categoria encontrada",NA,"não"
"693","ANEEL-PD-05785-2125","Desenvolvimento e avaliação de sistemas de proteção à corrosão em condutos forçados","nenhuma categoria encontrada",NA,"não"
"694","ANEEL-PD-05785-2205","Desenvolvimento de metodologia inovadora para avaliação da superação de componentes de subestações do Sistema de Transmissão","6.2",NA,"não"
"695","ANEEL-PD-05785-2207","Metodologia inovadora para monitoramento e controle da capacitação de trabalhadores que desenvolvem trabalho em instalações elétricas e serviços com eletricidade.","7.1",NA,"não"
"696","ANEEL-PD-05785-2203","Sistema Automatizado para Análise de Superação de Componentes de Subestações.","7.1",NA,"não"
"697","ANEEL-PD-05785-2202","Desenvolvimento de acessórios para utilização em condutores termorresistentes com núcleo de fibra de carbono","7.1",NA,"não"
"698","ANEEL-PD-05785-2104","Central de Tratamento de Dejetos Suínos - Projeto de Demonstração de Tecnologia Sustentável","nenhuma categoria encontrada",NA,"não"
