"","id","titulo_projeto","categorias","cat2","existe"
"1","ANEEL-PD-00390-0003","Desenvolvimento de Sistema de Gerenciamento do Ciclo de Vida dos Ativos Operacionais Considerando a Avaliação de Confiabilidade Global Análise de Risco e Dimensionamento da Capacidade das Instalações","""6.2"", ""7.1""",7.1,"sim"
"2","ANEEL-PD-00063-0008","MEMBRANAS COMPOSITAS PARA CÉLULAS COMBUSTIVEIS","nenhuma categoria encontrada",3.7,"sim"
"3","ANEEL-PD-00063-0012","GERAÇÃO DE ENERGIA POR REJEITOS DE BANANEIRAS","nenhuma categoria encontrada",3.4,"sim"
"4","ANEEL-PD-00063-0006","PSQF - Processos de Soluções da Qualidade do Fornecimento","nenhuma categoria encontrada",6.2,"sim"
"5","ANEEL-PD-00063-0022","PLANEJAMENTO ESTRATÉGICO DO SISTEMA ELÉTRICO","7.1",7.1,"sim"
"6","ANEEL-PD-00047-0001","Estudo e Desenvolvimento de Isolador Polimérico Modular para a Rede de Distribuição de Energia Elétrica","6.2",6.2,"sim"
"7","ANEEL-PD-00047-0005","Sistema computacional para Planejamento da Manutenção de Rede de Distribuição","nenhuma categoria encontrada",NA,"não"
"8","ANEEL-PD-00383-0010","Desenvolvimento de um Transformador Eletrônico para Sistemas Elétricos em Média Tensão-TRED","6.2",NA,"não"
"9","ANEEL-PD-02866-0003","Sistema de Previsão Integrada de Mercado de Energia Elétrica","7.1",7.1,"sim"
"10","ANEEL-PD-00385-0009","Avaliação da deplexão do aditivo antioxidante no OVI, como ferramenta de manutenção preditiva em equipamentos elétricos e avaliação da migração da umidade no sistema papel Kraft/OVI","6.2",3.4,"sim"
"11","ANEEL-PD-00047-0031","Instalações subterrâneas: protótipos de transformador blindado submersível de 750 ou de1000 kVA, de câmaras de transformação e de sistemas de monitoramento de cabos isolados e de dutos.","""2.1"", ""6.2""",NA,"não"
"12","ANEEL-PD-00047-0034","Sistema de aferição de transformadores de instrumento utilizando TPs e TCs ópticos sem interrupção de fornecimento.","nenhuma categoria encontrada",6.2,"sim"
"13","ANEEL-PD-05697-7908","Aplicação de técnicas de Inteligência Artificial baseada no histórico de transformadores de potência e na análise de gases dissolvidos para diagnóstico de falhas incipientes","6.2",NA,"não"
"14","ANEEL-PD-05697-8008","Desenvolvimento de um analisador portátil de gás dissolvido em óleo para diagnóstico remoto de falhas em múltiplos transformadores de potência","""2.1"", ""6.2""",6.2,"sim"
"15","ANEEL-PD-05697-8108","Desenvolvimento de um Sistema de Medição de Temperatura em Emendas de Cabos de Alta Tensão Utilizando Transdutores RFID-SAW","""3.1"", ""6.2""",NA,"não"
"16","ANEEL-PD-00383-9010","Desenvolvimento de um Transformador Eletrônico para Sistemas Elétricos em Média Tensão-TRED","6.2",NA,"não"
"17","ANEEL-PD-00043-0409","Pesquisa de Técnicas Alternativas para Proteção de Sistemas Elétricos de Potência Contra Surtos Eletromagnéticos","6.2",NA,"não"
"18","ANEEL-PD-00039-0016","Projeto de Pesquisa e Desenvolvimento para Implantação de um Piloto de Redes Inteligentes (SmartGrid) para Automação do Sistema Elétrico","6.2",6.2,"sim"
"19","ANEEL-PD-00043-0509","Construção e Aplicação de Supressor Magnético de Afundamentos para Cargas Sensíveis Industrial - SMASI","nenhuma categoria encontrada",6.2,"sim"
"20","ANEEL-PD-00068-0005","Desenvolvimento de Sistema Especialista de Diagnóstico baseado em Monitoramento on-line de ruídos em transformadores de Transmissão para identificação de defeitos elétricos internos","6.2",6.2,"sim"
"21","ANEEL-PD-00390-1040","Avaliação do efeito da temperatura sobre os materiais internos em transformadores isolados com óleo vegetal  (OVI) e diferentes isolações sólidas","""2.1"", ""3.1"", ""6.2""",6.2,"sim"
"22","ANEEL-PD-00394-0907","Educação Ambiental no processo de licenciamento: Construção Metodológica","nenhuma categoria encontrada",6.2,"sim"
"23","ANEEL-PD-00394-0929","Reologia Aplicada aos Concretos Utilizados em Usinas Hidrelétricas","nenhuma categoria encontrada",6.1,"sim"
"24","ANEEL-PD-00394-0935","Caracterização geoespacial e fitossociológica de remanescentes florestais nas áreas de influência do reservatório de Funil","2.1",NA,"não"
"25","ANEEL-PD-00394-0905","Concreto fibroso de alta performance em estruturas de usinas hidrelétricas: modelagem, experimentação e recomendações para projeto.","3.1",6.1,"sim"
"26","ANEEL-PD-00391-0002","Sistema Inteligente Automatizado Para Identificação e Localização de Faltas em Linhas de Distribuição de Energia Elétrica","6.2",6.2,"sim"
"27","ANEEL-PD-00068-0009","Sistema Inteligente para apoio ao Operador de Sistema Elétrico em Tempo Real para minorar os riscos de ocorrência de blackouts","nenhuma categoria encontrada",NA,"não"
"28","ANEEL-PD-00068-0004","Sistema Integrado de Informações para a Manutenção","6.2",6.2,"sim"
"29","ANEEL-PD-00391-0005","Desenvolvimento da segunda geração do Regulador de Tensão com Comutador Eletrônico de Tap (RECET)","1.4",1.1,"sim"
"30","ANEEL-PD-00391-0006","Desenvolvimento de um Compensador Universal com correção de VTCD - iUPQC","nenhuma categoria encontrada",6.2,"sim"
"31","ANEEL-PD-00394-0910","Barragens de Enrocamento com Núcleo Asfáltico - Modelagem Física e Numérica","nenhuma categoria encontrada",NA,"não"
"32","ANEEL-PD-00390-1031","Simulador Especialista de Tempo Real Para Apoio A Decisão (SIMULESP)","nenhuma categoria encontrada",6.2,"sim"
"33","ANEEL-PD-00040-0009","Aplicação de Misturas de Fluidos Biodegradáveis com Óleo Mineral Isolante em Equipamento de 15 kV de Maior Risco e Sensibilidade à Qualidade do Isolante Liquido","2.1",6.2,"sim"
"34","ANEEL-PD-00372-0007","Diagnóstico da corrosão em torres de linhas de transmissão, utilizando análise de laboratório e de campo e otimização na convivência com correntes de desequilíbrio circulantes em LTs.","6.2",6.2,"sim"
"35","ANEEL-PD-00394-0941","Análise Comparativa dos Fragmentos e Reflorestamentos no Entorno do Reservatório, Visando à Readequação de Projetos de Restauração na Eletrobrás Furnas","2.1",6.1,"sim"
"36","ANEEL-PD-00372-0008","Desenvolvimento e Construção de Sistema Robotizado para Reparos de Falhas de Cavitação em Turbinas Hidráulicas - FASE II","nenhuma categoria encontrada",3.6,"sim"
"37","ANEEL-PD-00394-0918","Modelagem de arco elétrico e interação arco-rede para uso de Religamento Monofásico","""6.2"", ""7.1""",NA,"não"
"38","ANEEL-PD-00372-0012","Representação da Ação Antrópica sobre o Meio Ambiente na Ilhas e Entorno do Reservatório da Barragem da UHE de Tucuruí, com a Utilização da Lógica Fuzzy e Redes Neurais Artificiais","""2.1"", ""3.6""",6.1,"sim"
"39","ANEEL-PD-05379-0001","Sistema Híbrido de Detecção e Localização de Faltas Permanentes em Sistemas de Distribuição Urbanos e Rurais: Desenvolvimento Metodológico, Implementação e Projeto Piloto","6.2",6.2,"sim"
"40","ANEEL-PD-00394-0926","Unidades Experimentais para Fins de Implantação de Mata Ciliar no Bioma Cerrado","nenhuma categoria encontrada",6.1,"sim"
"41","ANEEL-PD-00372-0013","Sistema de auxílio na identificação de causas de ocorrências no sistema elétrico pelo processamento de múltiplas fontes de dados","6.2",6.2,"sim"
"42","ANEEL-PD-00087-0087","UMC - Unidade de Monitoramento de Consumo","1.4",1.4,"sim"
"43","ANEEL-PD-06491-0023","Desenvolvimento de ligas resistentes à cavitação e novos procedimentos de reparo de trincas e cavitação em rotores de aço ASTM A743 CA6NM, para deposição por soldagem a plasma, MIG e aspersão térmica","3.1",6.1,"sim"
"44","ANEEL-PD-00068-0007","Procedimento para Avaliação de Vida Remanescente de Cabos de Extra-Alta Tensão com Isolação a Óleo Fluido","""2.1"", ""3.1"", ""6.2""",6.2,"sim"
"45","ANEEL-PD-00383-0039","Expansor de isolação para proteção dos condutores de rede compacta para mitigação da necessidade de podas de árvores.","6.2",6.2,"sim"
"46","ANEEL-PD-04950-0326","PA - Desenvolvimento de Modelos Explicativos e Verificação de Associação entre Inadimplência e Perda Não Técnica","nenhuma categoria encontrada",6.2,"sim"
"47","ANEEL-PD-00391-0007","Desenvolvimento de Novas Tecnologias Voltadas a Redes Inteligentes para enfrentar os novos Desafios Climáticos","6.2",6.2,"sim"
"48","ANEEL-PD-00372-0020","Avaliação On-line da Capacitância e Erros de Relação de Transformadores de Potencial Capacitivos","6.2",6.2,"sim"
"49","ANEEL-PD-02607-0004","Desenvolvimento de um simulador de operação em tempo real do sistema elétrico para capacitação, aperfeiçoamento e treinamento das equipes de operação.","nenhuma categoria encontrada",6.2,"sim"
"50","ANEEL-PD-00048-0026","Otimização da Distribuição de Reserva Técnica de Transformadores para Instrumentos em Sistemas de Transmissão","6.2",6.2,"sim"
"51","ANEEL-PD-00048-0067","Sistema de informações baseado em geoprocessamento e mineração de dados para detecção de queimadas próximas a linhas de transmissão e identificação em tempo real de raios em desarmes de linhas","6.2",6.2,"sim"
"52","ANEEL-PD-00048-0028","Sistema Preditivo Automático de Gestão de Falhas em Transformadores de Potência Baseado em Registros Oscilográficos e Mineração de Dados","6.2",6.2,"sim"
"53","ANEEL-PD-00048-0074","Estudo de células fotovoltaicas de multijunção com concentrador para geração de energia elétrica","nenhuma categoria encontrada",NA,"não"
"54","ANEEL-PD-00048-0087","Sistema de Previsão de Ventos e Geração Eólica em Sítios do NE","""3.2"", ""3.3""",3.2,"sim"
"55","ANEEL-PD-00048-0020","Sistema remoto de análise do estado operacional de equipamentos de alta tensão atravé do monitoremento do óleo isolante","""2.1"", ""3.1"", ""7.1""",6.2,"sim"
"56","ANEEL-PD-00048-0053","DIAGNÓSTICO DA DEGRADAÇÃO DE EQUIPAMENTOS DE ALTA TENSÃO POR APLICAÇÃO DE TÉCNICAS DE RECONHECIMENTO DE PADRÕES DE DESCARGAS PARCIAIS","""3.1"", ""6.2""",6.2,"sim"
"57","ANEEL-PD-04951-0346","PA - Desenvolvimento de novas metodologias para avaliação da distribuição espaço-temporal de cianobactérias e cianotoxinas em reservatórios, e os seus efeitos deletérios em peixes.","6.2",6.1,"sim"
"58","ANEEL-PD-00044-0012","APLICAÇÃO DE TÉCNICAS DE INTELIGENCIA ARTIFICIAL PARA ESTIMAÇÃO DE ESTADO DOS SISTEMAS ELETRICOS DE POTENCIA EM TEMPO REAL DE OPERAÇÃO","nenhuma categoria encontrada",6.2,"sim"
"59","ANEEL-PD-04951-0354","DE -  Desenvolvimento de Protótipo de Sistema de Medição Fasorial Sincronizada","6.2",6.2,"sim"
"60","ANEEL-PD-00383-0041","Sistema para diagnosticar as condições operacionais dos Pára-raios a Óxido Metálico sem Centelhadores em Linhas e Subestações de Alta Tensão, através de inspeções em campo com o sistema energizado.","""3.1"", ""6.2""",6.2,"sim"
"61","ANEEL-PD-04951-0358","PA - Tecnologias integradas de transporte dos gases da carbonização da madeira de eucalipto e beneficiamento de subprodutos para co-geração de energia elétrica com micro-turbinas","2.1",3.7,"sim"
"62","ANEEL-PD-04950-0423","D423 - DE - Desenv. de Modelo Funcional Smart Grid  através de integra. sistêmicas de soluções intelig. para automação da rede de distribuição, infraestr. avançada de medição e particip. do consumidor","6.2",6.2,"sim"
"63","ANEEL-PD-04950-0424","D424 - DE - Desenv. de uma Plataforma de Testes de Conformidade e Interoperabilidade de Dispositivos Smart Metering e Desenv. de uma Solução Segura de Comunic Híbrida WMAN-WiMAX para Automação de Rede","6.2",6.2,"sim"
"64","ANEEL-PD-04951-0343","PA - CONTROLE DO MEXILHÃO DOURADO:BIOENGENHARIA E NOVOS MATERIAIS PARA APLICAÇÕES EM ECOSSISTEMAS E  USINAS HIDRELÉTRICAS","nenhuma categoria encontrada",3.6,"sim"
"65","ANEEL-PD-04950-0317","PA - D317 - Sistemas de distribuição de energia elétrica auto-reconfiguráveis: contingenciamento e otimização","nenhuma categoria encontrada",6.2,"sim"
"66","ANEEL-PD-04950-0310","D310 - PA - Desenvolvimento de Metodologia para Identificação de Vãos Críticos em Linhas de Distribuição","nenhuma categoria encontrada",6.2,"sim"
"67","ANEEL-PD-00044-0014","Determinação do Estado Físico de Conservação de Isoladores através da Técnica de Rádio Frequência","6.2",6.2,"sim"
"68","ANEEL-PD-00369-0002","Metodologia  para representação e análise de redes de transmissão, subtransmissão e distribuição","6.2",NA,"não"
"69","ANEEL-PD-04950-0363","D363 - PA - Desenvolvimento de Modelos, Métodos e Ferramentas Computacionais de Apoio à Tomada de Decisões na Gestão Estratégica das Empresas de Energia Elétrica","nenhuma categoria encontrada",6.2,"sim"
"70","ANEEL-PD-04951-0339","GT339 - PA - SISTEMA DE MONITORAMENTO E DETECAO DE ROMPIMENTO DE CABOS EM LTs DE RELIGAMENTO ESPECIAL - REFLECTOMETRO DE POTÊNCIA.","6.2",6.2,"sim"
"71","ANEEL-PD-04951-0349","GT349 - DE - Metodologia para calcular o volume e a distribuição de sedimentos em reservatórios de barragens","nenhuma categoria encontrada",3.6,"sim"
"72","ANEEL-PD-04951-0340","PA - Desenvolvimento de Nova Metodologia para Diagnótico da Corrosão de Fundações em Grelhas e Dispositivos de Estaiamento","6.2",6.2,"sim"
"73","ANEEL-PD-00043-0809","Desenvolvimento de um sistema supervisor de controle da operação do sistema elétrico em lugares isolados utilizando predominantemente fontes alternativas de energia - Caso Ilha de Fernando de Noronha.","6.2",3.7,"sim"
"74","ANEEL-PD-00043-0909","Construção e Aplicação de Supressor Magnético de Afundamentos para Cargas Sensíveis Industrial - SMASI","nenhuma categoria encontrada",6.2,"sim"
"75","ANEEL-PD-04950-0311","D311 - DE - Robô de Inspeção de Linha","6.2",6.2,"sim"
"76","ANEEL-PD-05707-0943","Desenvolvimentos de Cátodos de Células a Combustível de Óxido Sólido de Temperatura Intermediaria","""1.4"", ""3.1""",5.2,"sim"
"77","ANEEL-PD-05707-0941","Desenvolvimento de Metodologia para Avaliação e Projeto de Sistemas de Aterramento Embutido em Concreto","6.2",6.2,"sim"
"78","ANEEL-PD-00372-0025","Desenvolvimento de Ferramentas para Otimização do Desempenho de Estruturas e Feixes de Cabos de Linhas Aéreas submetidos a Ação de Ventos.","6.2",6.2,"sim"
"79","ANEEL-PD-00372-0023","Desenvolvimento de nano materiais para revestimento de turbinas hidráulicas visando aumento da vida útil das mesmas","nenhuma categoria encontrada",7.1,"sim"
"80","ANEEL-PD-00372-0022","Desenvolvimento de um Sistema Indicador de Qualidade de Água Específico para a Região Amazônica.","nenhuma categoria encontrada",6.1,"sim"
"81","ANEEL-PD-00372-0027","Desenvolvimento de protótipo de instrumento que realiza diagnóstico, de forma autônoma e automática,  de falhas mecânicas de hidrogeradores, embarcando técnicas de inteligência artificial.","6.2",6.2,"sim"
"82","ANEEL-PD-05161-0004","Dinâmica da ictiofauna e condicionantes ambientais nos reservatórios da LIGHT e em trechos  do rio Paraíba do Sul","nenhuma categoria encontrada",6.2,"sim"
"83","ANEEL-PD-05161-0005","Avaliação do potencial de utilização ecologicamente compatível da biomassa de macrófitas aquáticas geradas no processo de controle mecânico nos reservatórios da Light Energia S.A","""3.4"", ""6.2""",3.4,"sim"
"84","ANEEL-PD-05785-0947","Desenvolvimento de metodologia para medição dos potenciais em malhas de terra de SEs urbanas","nenhuma categoria encontrada",6.2,"sim"
"85","ANEEL-PD-00048-0084","Técnicas de Controle de Inserção Rápida de Reatores Derivação","6.2",NA,"não"
"86","ANEEL-PD-00048-0055","Desenvolvimento de um modelo sustentável voltado à mitigação de processos erosivos aplicado a faixas de servidão de Linhas de Transmissão e assoreamento de microbacias","6.2",NA,"não"
"87","ANEEL-PD-00048-0068","Elaboração de Plano de Insvestigação Geotécnica com Base em Mapas Pedológicos..para estudo de Solos para em Linhas de Transmissão","6.2",NA,"não"
"88","ANEEL-PD-00390-1056","Desenvolvimento de conector perfurante para condutores do tipo protegido em redes de distribuição de alta tensão de 15kV, 25kV e 34,5kV","""3.1"", ""6.2""",6.2,"sim"
"89","ANEEL-PD-04951-0350","GT350 - PA - Metodologia para previsão de curto, médio e longo prazo de descargas atmosféricas e a visualização na plataforma Google Maps - Incorporação das mudanças climáticas na previsão","6.2",6.2,"sim"
"90","ANEEL-PD-04950-0306","D306 - CS - REVITALIZAÇÃO E REPOTENCIAÇÃO DE TRANSFORMADORES DE POTÊNCIA E DESENVOLVIMENTO DE TCs A ÓLEO VEGETAL","2.1",6.2,"sim"
"91","ANEEL-PD-00043-1009","Auto Regulador Magnético de Tensão a Reator Naturalmente Saturado - ARMTRS, em 13,8kV - Cabeça de Série","nenhuma categoria encontrada",6.2,"sim"
"92","ANEEL-PD-00394-0940","Desenvolvimento de Metodologia para a Estimativa de Estoque e Dinâmica de Carbono em Áreas de Preservação Permanente","nenhuma categoria encontrada",NA,"não"
"93","ANEEL-PD-04951-0331","GT331 - PA - Desenvolvimento de concretos sustentáveis com uso de cinzas de bagaço de cana-de-açúcar","3.4",6.1,"sim"
"94","ANEEL-PD-00039-0045","Desenvolvimento de técnicas e ferramentas para determinação das caracteristicas de solos e avaliação de sistemas de aterramento.","6.2",6.2,"sim"
"95","ANEEL-PD-00371-0005","Ferramenta Computacional de Alocação Ótima Simultânea de Dispositivos de Proteção e Manobra em Redes de Distribuição de Energia Elétrica Considerando a Geração Distribuída","6.2",6.2,"sim"
"96","ANEEL-PD-00371-0001","Avaliação da Sustentabilidade de Sistemas Elétricos Isolados por meio da Diversificação da Matriz Energética Local","nenhuma categoria encontrada",3.7,"sim"
"97","ANEEL-PD-00371-0006","Avaliação de Desemoenho de Usinas Termoelétricas a Diesel","nenhuma categoria encontrada",2.1,"sim"
"98","ANEEL-PD-00371-0004","Dimensionamento de Transformador para Suprimento a Múltiplas Unidades de Consumo com Base em Árvore de Decisão.","""6.2"", ""7.1""",7.1,"sim"
"99","ANEEL-PD-06072-0263","Estudos para a eficácia de detecção de descargas parciais por emissão acústica como técnica preditiva de manutenção em transformadores de potência imersos em óleo isolante.","2.1",6.2,"sim"
"100","ANEEL-PD-00372-0028","Pesquisa e Desenvolvimento de Dispositivo de Fluxo Linearmente Variável para Aplicação em Reatores e, ou Transformadores","nenhuma categoria encontrada",6.2,"sim"
"101","ANEEL-PD-00385-0030","Arbor","nenhuma categoria encontrada",NA,"não"
"102","ANEEL-PD-00382-0066","Monitoramento da Vegetação e Uso do Solo em Faixas de Servidão de Linhas de Transmissão de Energia Elétrica","6.2",6.2,"sim"
"103","ANEEL-PD-00385-0031","Seguidores solares para sistemas fotovoltaicos conectados à rede: Sistemas com e sem concentração","6.2",3.1,"sim"
"104","ANEEL-PD-00038-0001","Metodologia para o cálculo e gerenciamento de perdas em redes de distribuição de energia elétrica","6.2",6.2,"sim"
"105","ANEEL-PD-00064-1024","Efeitos de Mudanças Climáticas no Regime Hidrológico de Bacias Hidrográficas e na Energia Assegurada de Aproveitamentos Hidrelétricos.","nenhuma categoria encontrada",3.6,"sim"
"106","ANEEL-PD-02866-0210","Sistema de Gestão do Conhecimento para Apoio a Operação em Tempo Real de Sistemas Elétricos de Potência","nenhuma categoria encontrada",6.2,"sim"
"107","ANEEL-PD-06072-0264","Veículo Aéreo Não Tripulado (VANT) como Ferramenta de Auxílio na Manutenção de Linhas de Transmissão","6.2",6.2,"sim"
"108","ANEEL-PD-06491-0219","Sistema Inteligente Híbrido de Análise em Tempo Real de Perturbações no Sistema Elétrico","7.1",6.2,"sim"
"109","ANEEL-PD-04950-0370","D370 - PA - Desenvolvimento de uma ferramenta computacional de Otimização Multicritério para Localização Estratégica de Novas Subestações considerando a Projeção Espacial da Carga","7.1",7.1,"sim"
"110","ANEEL-PD-04950-0422","PA - Metodologia para a tomada de decisão na gestão de ativos: uma abordagem integrada via teoria de opções reais","nenhuma categoria encontrada",6.2,"sim"
"111","ANEEL-PD-00382-0067","Programa de prevenção, tratamento e redução de litígios de consumo no setor elétrico","6.2",6.2,"sim"
"112","ANEEL-PD-00382-0054","Conector especializado para corte de fornecimento a cliente de baixa tensão - fases de cabeça de série e lote pioneiro.","nenhuma categoria encontrada",6.2,"sim"
"113","ANEEL-PD-06585-1103","Estudo e análise dos efeitos de penetração de umidade e da contaminação sobre a durabilidade e o desempenho elétrico dos pára-raios poliméricos de distribuição.","nenhuma categoria encontrada",6.2,"sim"
"114","ANEEL-PD-06491-0022","CARACTERIZAÇÃO DE TRANSIENTES MUITO RÁPIDOS - VFT ATRAVÉS DE MEDIÇÃO EM CAMPO E SIMULAÇÃO DIGITAL EM SUBESTAÇÕES ISOLADAS A GÁS SF6 - SIG E SUBESTAÇÕES ISOLADAS A AR - SIA.","2.1",3.6,"sim"
"115","ANEEL-PD-00372-0029","Desenvolvimento de novas funcionalidades da ferramenta computacional para análise e avaliação das grandezas relacionadas à qualidade da energia elétrica","6.2",6.2,"sim"
"116","ANEEL-PD-00382-0065","Cabeça de Série de Emenda de Reparo Provisório de Montagem Rápida para Cabo Óleo Fluido classe 145 kV","2.1",6.2,"sim"
"117","ANEEL-PD-04951-0338","GT338 - DE - Desenvolvimento de sistema integrado para supervisão e orientação à operação remota segura de usinas hidrelétricas","6.2",6.2,"sim"
"118","ANEEL-PD-05785-0926","Desenvolvimento de uma Metodologia para Identificação em Tempo Real da Relação CausaEfeito de Grandes Desligamentos em Sistemas Elétricos de Potência com Ênfase na Redução do Tempo de Restabelecimento","6.2",6.2,"sim"
"119","ANEEL-PD-06585-1102","Desenvolvimento de metodologia para padronização de subestações aderente aos conceitos Smart Grid, considerando o uso do protocolo de comunicação IEC61850","7.1",7.1,"sim"
"120","ANEEL-PD-04950-0420","Desenvolvimento de Modem PLC para Aplicações de Telecomunicações e Smart Grids em Redes de Baixa tensão","nenhuma categoria encontrada",6.2,"sim"
"121","ANEEL-PD-04951-0336","DE - GT336 - Desenvolvimento de ferramentas para otimização de malhas de controle de usinas geradoras de energia elétrica","6.2",6.2,"sim"
"122","ANEEL-PD-00394-0912","Formação de Vórtices em Tomadas d'água de Usinas Hidrelétricas","nenhuma categoria encontrada",6.1,"sim"
"123","ANEEL-PD-04950-0390","D390 - DE - Desenvolvimento de Funções Avançadas de EMS (Energy Management System) - Fase II","""6.2"", ""7.1""",6.2,"sim"
"124","ANEEL-PD-00372-0031","Metodologia de Controle Preventivo Baseada em Árvore de Decisão para a Melhoria da Segurança Estática e Dinâmica do Sistema Interligado da Eletronorte","nenhuma categoria encontrada",3.6,"sim"
"125","ANEEL-PD-00372-0032","Implantação de Instruções Técnicas Virtuais de Operação e Manutenção para Geração e Desenvolvimento de GAME e Simulador de Modulo de Falhas e Defeitos","nenhuma categoria encontrada",NA,"não"
"126","ANEEL-PD-06585-1101","Projeto, Implantação e Operação de uma rede de medição da irradiação solar direta para o estado da PB visando a elaboração de uma metodologia para localização de centrais solares termoelétricas.","6.2",3.7,"sim"
"127","ANEEL-PD-00095-0002","Desenvolvimento de um sistema para leitura remota de medidores eletrônicos de energia","nenhuma categoria encontrada",NA,"não"
"128","ANEEL-PD-00095-0001","Modelagem e Identificação de Parâmetros de um Sistema de Distribuição Primário de Energia Elétrica em Média Tensão","6.2",NA,"não"
"129","ANEEL-PD-00394-0916","Mitigação de Poluição Sonora nos Arredores de Estações Conversoras","nenhuma categoria encontrada",NA,"não"
"130","ANEEL-PD-00394-0904","Avaliação e monitoramento da qualidade da água do Reservatório da Usina Hidroelétrica de Furnas através de vertebrados aquáticos - Fase 2","""2.1"", ""3.6""",NA,"não"
"131","ANEEL-PD-00063-0033","PA0033 - ELEMENTO HÍBRIDO DE BAIXO CUSTO PARA CONCENTRAÇÃO E COMUNICAÇÃO ENTRE MEDIDOR E SE","nenhuma categoria encontrada",6.2,"sim"
"132","ANEEL-PD-00063-0018","CS0018 - CONDICIONADOR DUAL EFICIENTE DE BAIXO CUSTO","1.4",1.2,"sim"
"133","ANEEL-PD-00063-0031","PA0031 - METODOLOGIA PARA APOIO À DECISÃO SOBRE INVESTIMENTO EM PLANEJAMENTO","7.1",7.1,"sim"
"134","ANEEL-PD-00063-0038","CS0038 - SISTEMA DE DIAGNÓSTICO DE FALHA EM PONTO DE IP","nenhuma categoria encontrada",6.2,"sim"
"135","ANEEL-PD-00063-0023","PA0023 - CONEXÃO DE CARGAS EM PONTOS DE DHT CRÍTICA","nenhuma categoria encontrada",6.2,"sim"
"136","ANEEL-PD-00063-0026","PB0026 - ESTUDO DOS IMPACTOS DA INSERÇÃO DE MICRORREDES E MICROGERAÇÃO EM SISTEMAS DE DISTRIBUIÇÃO","7.1",7.1,"sim"
"137","ANEEL-PD-00063-0036","PA0036 - CENÁRIOS ECONÔMICOS MUNICIPAIS PARA PROJEÇÃO REGIONAL DE MERCADO","nenhuma categoria encontrada",7.1,"sim"
"138","ANEEL-PD-00063-0025","PA0025 - CAMPANHA OTIMIZADA DE MEDIÇÃO","nenhuma categoria encontrada",6.2,"sim"
"139","ANEEL-PD-00063-0016","CS0016 - FILTRO HÍBRIDO PARA APLICAÇÕES DE BAIXO CUSTO","nenhuma categoria encontrada",6.2,"sim"
"140","ANEEL-PD-00063-0037","PA0037 - MATRIZ DE REUSO E DESCARTE LIMPO NA CPFL","nenhuma categoria encontrada",6.2,"sim"
"141","ANEEL-PD-00063-0024","CS0024 - OTIMIZAÇÃO DOS RECURSOS DE MANUTENÇÃO","nenhuma categoria encontrada",6.2,"sim"
"142","ANEEL-PD-00063-0039","DE0039 - DESENVOLVIMENTO DE PROCESSO: FABRICAÇÃO DE SF6","nenhuma categoria encontrada",6.2,"sim"
"143","ANEEL-PD-00063-0027","DE0027 - SMART SUBSTATION","6.2",6.2,"sim"
"144","ANEEL-PD-00385-0036","Monitoramento de conexões e emendas em subestações","6.2",6.2,"sim"
"145","ANEEL-PD-00394-0909","Elaborar metodologia de avaliação global dos impactos causados por programas de conservação de energia, enquanto instrumentos de política pública","1.4",NA,"não"
"146","ANEEL-PD-04951-0345","PB - Desenvolvimento de ferramentas moleculares (DNA) para monitoramento ambiental de peixes e plantéis de piscicultura.","nenhuma categoria encontrada",6.1,"sim"
